Category,Source,Title,Content Summary,URL,Date of Publication
Ciencia y tecnología,La Jornada,Datos geológicos permiten evitar riesgos en la construcción de edificios: académica,"La información geológica es como la historia: nos permite entender qué va pasar en el futuro porque nos proporciona datos para aprender del pasado y no repetir errores, dice a La Jornada María Teresa Ramírez Herrera, investigadora del Instituto de Geografía de la Universidad Nacional Autónoma de México (UNAM), mientras inspecciona un bloque de tierra de un metro de largo por 10 centímetros de ancho extraído de las costas de Colima.",https://www.jornada.com.mx/2024/06/20/ciencias/a06n1cie?partner=rss,20/06/24
Ciencia y tecnología,Expansión,Honor lanzará al mercado un smartphone plegable más pequeño,Se trata del Honor Magic V flip con el que la marca de origen chino busca captar una mayor cuota de mercado de los teléfonos plegables.,https://expansion.mx/tecnologia/2024/06/20/honor-magic-v-flip-caracteristicas,20/06/24
Ciencia y tecnología,Expansión,"Tras intentar sacar a Sam Altman de OpenAI, Sutskever abre empresa de IA segura","Ilya Sutskever, antiguo científico en jefe de OpenAI, fue una de los ejecutivos que fraguó la salida de Sam Altman de la empresa en noviembre pasado.",https://expansion.mx/tecnologia/2024/06/20/ilya-sutskever-abre-empresa-de-ia-segura,20/06/24
Ciencia y tecnología,Expansión,"Mercado Libre no sólo quiere competir con Amazon, también con Meta","Sean Summers, vicepresidente de Mercadolibre, no sólo hace énfasis en el éxito que ha tenido el negocio de e-commerce, sino en el crecimiento de otras verticales.",https://expansion.mx/tecnologia/2024/06/20/mercadolibre-quiere-competir-meta-tiktok,20/06/24
Cultura,La Jornada,Artistas mexicanos contemporáneos exponen en Madrid,"Madrid. Obra de algunos de los artistas contemporáneos mexicanos más importantes, como Damián Ortega, Teresa Margolles, Carlos Amorales y Jorge Méndez Blake, entre otros, se expone en el Instituto de México en Madrid, que acoge una parte de la colección privada Collegium. En la muestra hay dos hilos comunicantes: el trabajo con la materia y la literatura como puente creativo con las artes plásticas.",https://www.jornada.com.mx/2024/06/20/cultura/a04n2cul?partner=rss,20/06/24
Cultura,La Jornada,Comienza el INAH balance de su gestión en el actual sexenio,"Con miras a la conclusión del actual gobierno y el cambio de administración federal, el Instituto Nacional de Antropología e Historia (INAH) comenzó ayer un balance de la acción institucional en este sexenio para determinar los alcances, los pendientes y las tareas encaminadas al proceso de fortalecimiento de esa institución. El propósito es integrar un diagnóstico que será entregado a las próximas autoridades, informó Diego Prieto, su director general.",https://www.jornada.com.mx/2024/06/20/cultura/a05n2cul?partner=rss,20/06/24
Cultura,La Jornada,El dueto Laura y Luis rinde homenaje a Consuelo Velázquez y María Grever,"El dueto Laura y Luis, dedicado a la interpretación de repertorios populares, clásicos y tradicionales de Latinoamérica, celebrará su aniversario 17 con una serie de presentaciones que comienzan hoy en el auditorio Blas Galindo del Centro Nacional de las Artes (Cenart).",https://www.jornada.com.mx/2024/06/20/cultura/a05n1cul?partner=rss,20/06/24
Cultura,La Jornada,Reasignarán casi 600 mdp al Proyecto Chapultepec,"La Secretaría de Cultura (SC) federal reasignará 596 millones 800 mil pesos de su presupuesto para realizar “de manera eficiente y eficaz” las obras, los proyectos ejecutivos, así como todas las adquisiciones de insumos requeridos para concluir el Proyecto Complejo Cultural Bosque de Chapultepec, se informó en el convenio modificatorio de asignación de recursos que se publicó ayer en el Diario Oficial de la Federación.",https://www.jornada.com.mx/2024/06/20/cultura/a05n3cul?partner=rss,20/06/24
Cultura,La Jornada,Vilma Fuentes: Los vagos de París,"Los clochards o vagabundos celestes, como los denominaba Jack Kerouac, forman una población flotante en París. Solitarios o sociables, poseen un domicilio aunque no sea sino en la esquina de una callejuela, alcohólicos agresivos o ebrios somnolientos, desgreñados y sucios, más o menos pulcros, sin edad, algunos piden limosna, otros recurren a ayudas sociales, hay quienes tienen una familia, un pariente que los recoge durante algunos días y del que huyen celosos de su libertad callejera, libres de horarios, hay quienes narran su vida a los pasantes que se interesan en ellos y también quienes la inventan a gusto del interlocutor, intuitivos, con ese instinto que se aprende en la escuela de la calle, los clochards son figuras indefinidas del paisaje parisiense.",https://www.jornada.com.mx/2024/06/20/cultura/a03a1cul?partner=rss,20/06/24
Cultura,La Jornada,Revela Damián Ortega las entrañas de Estridentópolis,"El artista Damián Ortega sostuvo que se identificaba más con la historia de la caricatura en México que con la de la pintura; significaba “desechar la idea del arte, como lo que se estaba haciendo en las escuelas o que estábamos viendo en espacios, galerías o museos”. Así lo dijo en la presentación del libro Estridentópolis (RM) en el Palacio de Bellas Artes.",https://www.jornada.com.mx/2024/06/20/cultura/a04n1cul?partner=rss,20/06/24
Cultura,La Jornada,Publican mecanoescrito inédito de Efraín Huerta,"El legado de Efraín Huerta (Silao, 1914-Ciudad de México, 1982) sigue sorprendiendo a la comunidad literaria con la publicación reciente de un mecanoescrito inédito en formato de libro.",https://www.jornada.com.mx/2024/06/20/cultura/a02n1cul?partner=rss,20/06/24
Cultura,La Jornada,Falleció la fotógrafa Sara Facio a los 92 años,"La fotógrafa, editora y gestora cultural Sara Facio murió este martes a los 92 años en Buenos Aires, Argentina, informó la Fundación María Elena Walsh, organización que dirigía en la actualidad.",https://www.jornada.com.mx/2024/06/20/cultura/a03n1cul?partner=rss,20/06/24
Sociedad y Justicia,La Jornada,Presentan corto en memoria de jesuitas asesinados en Cerocahui,"Con motivo del segundo aniversario del asesinato de los sacerdotes jesuitas Javier Campos y Joaquín Mora en Cerocahui, Chihuahua, la Compañía de Jesús en México dio a conocer el cortometraje Yawimé: Las huellas de Javier y Joaquín, producido por integrantes de la congregación de la Tarahumara y las fundaciones Loyola y Sertull.",https://www.jornada.com.mx/2024/06/20/sociedad/037n2soc?partner=rss,20/06/24
Sociedad y Justicia,La Jornada,Indígenas de Guerrero denuncian que no se respetan sus usos y costumbres,"Chilpancingo, Gro., Autoridades comunales de los municipios de Malinaltepec, Iliatenco y Tlacoapa, en la Montaña Alta de Guerrero, integrantes del Concejo Regional de Autoridades Agrarias en Defensa del Territorio (Craadet), dieron a conocer que el Registro Agrario Nacional (RAN) rechazó la inscripción de sus estatutos y reglamentos elaborados mediante sus usos y costumbres.",https://www.jornada.com.mx/2024/06/20/sociedad/037n1soc?partner=rss,20/06/24
Mundo,La Jornada,Ramaphosa jura para segundo mandato en Sudáfrica,,https://www.jornada.com.mx/2024/06/20/mundo/030n4mun?partner=rss,20/06/24
Mundo,La Jornada,Llama la OTAN a conformar un “frente unido” ante arreglo Pyongyang-Moscú,"Ottawa. El nuevo pacto defensivo de Rusia con Corea del Norte muestra el creciente alineamiento entre potencias autoritarias y subraya la importancia de que las democracias presenten un frente unido, afirmó ayer el jefe de la Organización del Tratado del Atlántico Norte (OTAN), Jens Stoltenberg.",https://www.jornada.com.mx/2024/06/20/mundo/027n2mun?partner=rss,20/06/24
Mundo,La Jornada,Al menos 900 muertos en la peregrinación a La Meca por calor extremo,"Riad. La peregrinación a La Meca, conocida como El hach, se saldó con la muerte de unos 900 fieles debido al calor extremo; aproximadamente 600 de los fallecidos son de nacionalidad egipcia. En la Gran Mezquita las temperaturas alcanzaron el lunes 51.8 grados Celsius.",https://www.jornada.com.mx/2024/06/20/mundo/029n2mun?partner=rss,20/06/24
Mundo,La Jornada,Rusia y Norcorea suscriben acuerdo de ayuda mutua,"Moscú. Convencidos de que se enfrentan a un mismo enemigo, Estados Unidos, los líderes de Rusia, Vladimir Putin, y de Corea del Norte, Kim Jong-un, firmaron ayer en Pyongyang el Acuerdo Integral de Asociación Estratégica, en una ceremonia que transmitió en directo la televisión local el segundo y último día de la visita oficial del presidente ruso al país asiático, la primera en casi un cuarto de siglo.",https://www.jornada.com.mx/2024/06/20/mundo/027n1mun?partner=rss,20/06/24
Mundo,La Jornada,EU cancela reunión de “alto nivel” con Israel,"El Cairo. El gobierno de Joe Biden reaccionó ayer de manera furiosa a las declaraciones del primer ministro israelí, Benjamin Netanyahu, quien la víspera declaró que es “inconcebible” que Estados Unidos frene el envío de armas y municiones destinadas a Israel para su guerra en Gaza y, en represalia, canceló una reunión de alto nivel con funcionarios israelíes sobre Irán.",https://www.jornada.com.mx/2024/06/20/mundo/028n1mun?partner=rss,20/06/24
Mundo,La Jornada,Ley en Luisiana ordena exhibir en escuelas los Diez Mandamientos,"Washington y Nueva York. El gobernador del estado de Luisiana, Jeff Landry, promulgó una ley que obliga a exhibir los Diez Mandamientos de la Biblia cristiana en todas las aulas de sus escuelas, parte de lo que un juez de la Suprema Corte de Estados Unidos afirmó este mes que ya hay una batalla en curso para “retornar” a este país a ser “un lugar de piedad”, o sea, una nación cristiana.",https://www.jornada.com.mx/2024/06/20/mundo/029n1mun?partner=rss,20/06/24
Mundo,La Jornada,Sistemática violación de Tel Aviv a las leyes de guerra: ONU,"Una investigación de la Organización de Naciones Unidas (ONU) sobre los bombardeos del ejército israelí en Gaza reveló que se han “violado de manera sistemática” las leyes de la guerra respecto del uso de bombas y la supuesta falta de distinción entre combatientes y civiles, de acuerdo con la Oficina del Alto Comisionado para los Derechos Humanos.",https://www.jornada.com.mx/2024/06/20/mundo/028n2mun?partner=rss,20/06/24
Mundo,La Jornada,Líneas de transmisión defectuosas provocan apagón en todo Ecuador,"Quito. El suministro eléctrico se restableció casi por completo en Ecuador ayer por la tarde tras un apagón nacional que afectó a usuarios residenciales, hospitales y al sistema de Metro de la capital. Fue un fallo que las autoridades atribuyeron a líneas de transmisión defectuosas.",https://www.jornada.com.mx/2024/06/20/mundo/030n1mun?partner=rss,20/06/24
Mundo,La Jornada,Frenan en Brasil proyecto de ley que criminaliza el aborto en caso de violación,"Brasilia. La Cámara de Diputados de Brasil revirtió su decisión de acelerar la gestión de un polémico proyecto de ley que contempla criminalizar el aborto en caso de violación, luego de que el avance relámpago de la medida desató protestas, informó ayer su presidente.",https://www.jornada.com.mx/2024/06/20/mundo/030n2mun?partner=rss,20/06/24
Mundo,La Jornada,Nueva andanada de insultos de Milei al presidente de España,"Madrid. En vísperas de su segunda visita privada a España, desde que asumió el poder en Argentina, el presidente de Argentina, Javier Milei, calificó al mandatario español, el socialista Pedro Sánchez, de “cobarde” y de “atacar a la libertad de expresión” con un “modelo” similar al del gobernante venezolano, Nicolás Maduro.",https://www.jornada.com.mx/2024/06/20/mundo/030n3mun?partner=rss,20/06/24
Tendencias,Expansión,Corona Capital 2024: cartel y precios de boletos,"Después de que la banda Toto se adelantara a publicar el line up, el esperado festival publicó en redes sociales el cartel completo de su edición 2024.",https://expansion.mx/tendencias/2024/06/20/corona-capital-2024-cartel-precios,20/06/24
Tendencias,Expansión,¿Cuándo es el solsticio de verano 2024 y a qué hora empieza en México?,"Te decimos cuándo entra el solsticio de verano de 2024 en México, el día más largo y la noche más corta del año.",https://expansion.mx/tendencias/2024/06/20/solsticio-de-verano-2024,20/06/24
Opinión,La Jornada,Editorial: Bares irregulares: evitar tragedias,"La Asociación  Nacional de la Industria de Discotecas, Bares y Centros de Espectáculos (Anidice) denunció que en la Ciudad de México operan alrededor de 4 mil bares clandestinos, más del doble de los formales, lo cual constituye una competencia desleal para sus agremiados y, ante todo, un riesgo para quienes asisten a establecimientos que no cumplen con los requisitos mínimos de salubridad y protección civil. De acuerdo con el organismo empresarial, esta situación es propiciada por el cúmulo de dificultades con que se encuentra quien desea abrir estos tipos de negocios, percepción corroborada por cifras oficiales: en el sexenio que está por concluir, apenas siete antros, centros nocturnos o casas de apuestas se han registrado ante las instancias correspondientes.",https://www.jornada.com.mx/2024/06/20/opinion/002a1edi?partner=rss,20/06/24
Opinión,La Jornada,Ilán Semo: La corte de la discordia,"La Organización  de Naciones Unidas (ONU) es un organismo extraño. Si su cometido original fue –y continúa siendo– preservar la paz entre las naciones, su eficiencia ha sido, desde su fundación, prácticamente nula. Hoy, al igual que antes de 1948, en la esfera mundial no existe ningun poder superior al cual apelar en caso de conflicto. Las relaciones entre las naciones se rigen por la fuerza que cada una es capaz de ejercer sobre las otras, y no por ningún tipo de ley general. En otras palabras, valga el paroxismo: el orden mundial tiene un carácter esencialmente anárquico.",https://www.jornada.com.mx/2024/06/20/opinion/021a2pol?partner=rss,20/06/24
Opinión,La Jornada,Antonio Malacara: Jazz,"En el México contracultural de todos tan conocido (bueno, casi todos), y de algunos tan temido, han sucedido y suceden encuentros con aroma de prodigio. Tal cual sucedió cuando el pianista Pablo Castro, el contrabajista Pablo Flores y el baterista costarricense Pablo Loaiza formaban la sección rítmica del cuarteto Bad Lemur. En 2019 el guitarrista deja el proyecto y los tres Pablos continúan como trío. Las rutas se replantean. El nombre ya estaba dado.",https://www.jornada.com.mx/2024/06/20/opinion/a09o1esp?partner=rss,20/06/24
Opinión,La Jornada,Francisco Javier Guerrero: La gratitud de Claudia Sheinbaum,"A finales de 1978  un grupo de intelectuales del Partido Comunista Mexicano asistimos a un congreso sobre capitalismo contemporáneo celebrado en Moscú, capital de la fenecida Unión Soviética. No estoy muy seguro de que todos fuéramos intelectuales, pero al menos sí lo eran el lúcido Enrique Semo y el cosmopolita Roger Bartra, quien entonces era marxista y ahora goza de las delicias del capitalismo al igual que Mario Vargas Llosa.",https://www.jornada.com.mx/2024/06/20/opinion/020a2pol?partner=rss,20/06/24
Opinión,La Jornada,Rosa Miriam Elizalde: Que suenen los timbales,"Un submarino ruso  surcó las aguas cubanas el otro día. En realidad, no fue sólo un sumergible el que hizo el bojeo por la costa norte de Cuba. El grupo de barcos de la Flota del Norte que llegó a los mares tropicales está integrado por la fragata Almirante Gorshkov, el buque cisterna de suministros Akademik Pashin y el remolcador de rescate Nikolai Chiker, equipado con un helipuerto.",https://www.jornada.com.mx/2024/06/20/opinion/021a1pol?partner=rss,20/06/24
Opinión,La Jornada,Sergio Ramírez: La llave guardada,"Uno de estos días,  por azar, me encontré en el forro de una maleta las llaves de mi casa de Managua. Me las había metido en el bolsillo, como siempre, aquella mañana de mayo de 2021 en que mi mujer y yo salimos hacia el aeropuerto sin saber que, al cerrarse la puerta tras nuestros pasos, ya no volveríamos a traspasar el umbral.",https://www.jornada.com.mx/2024/06/20/opinion/020a1pol?partner=rss,20/06/24
Opinión,Expansión,Nearshoring y sus desafíos laborales,Los años posteriores a la implementación de la reforma laboral en México están siendo los de mayor crecimiento industrial por cuenta de la inversión extranjera.,https://expansion.mx/opinion/2024/06/20/nearshoring-y-sus-desafios-laborales,20/06/24
Opinión,Expansión,El bienestar emocional: la clave de un entorno laboral saludable,"Considerando que el clima laboral influye directamente en los colaboradores, un ambiente de trabajo positivo fomenta la participación, la productividad y el logro de objetivos.",https://expansion.mx/opinion/2024/06/20/el-bienestar-emocional-la-clave-de-un-entorno-laboral-saludable,20/06/24
Opinión,Expansión,La colaboración con IA potencia nuestras capacidades humanas únicas,"Si bien la Inteligencia Artificial nos puede parecer una amenaza, también se revela como una oportunidad de colaboración sin precedentes que podemos capitalizar a favor del progreso y la innovación.",https://expansion.mx/opinion/2024/06/20/colaboracion-con-ia-potencia-capacidades-humanas-unicas,20/06/24
Opinión,Expansión,Tendencias que están revolucionando las cadenas de suministro en el 2024,Tener esquemas tan diversos de comercialización ha complicado el proceso de planear la demanda y consecuentemente los inventarios necesarios para satisfacer las necesidades de los consumidores.,https://expansion.mx/opinion/2024/06/20/tendencias-que-estan-revolucionando-las-cadenas-de-suministro-en-el-2024,20/06/24
Opinión,Expansión,¿Es posible ‘hackear’ la mente?,Podemos re-programar nuestra mente al cambiar la narrativa que nos contamos día a día.,https://expansion.mx/opinion/2024/06/20/es-posible-hackear-la-mente,20/06/24
Espectáculos,La Jornada,Salvan el último cine asociativo de París,"París. Una agrupación de cinéfilos anunció la compra del último cine asociativo independiente de París, tras años de movilización y con el apoyo de grandes nombres de la industria, como Martin Scorsese y Quentin Tarantino.",https://www.jornada.com.mx/2024/06/20/espectaculos/a08n2esp?partner=rss,20/06/24
Espectáculos,La Jornada,"La defensa de los animales da sentido a mi vida laboral, asegura Moby","La pantalla está negra. Moby prefiere hacer entrevistas fuera de cámara, pero creo que podemos decir con certeza que no tiene cabello, usa gafas cuadradas y en su brazo derecho lleva tatuada las palabras ANIMAL y DERECHOS.",https://www.jornada.com.mx/2024/06/20/espectaculos/a07n1esp?partner=rss,20/06/24
Espectáculos,La Jornada,Chico Buarque cumple 80 años,"El reconocido escritor, compositor y cantante brasileño Chico Buarque cumplió ayer 80 años y su canción más tocada en el país desde hace varios años es la versión en portugués de Yolanda, del cubano Pablo Milanés.",https://www.jornada.com.mx/2024/06/20/espectaculos/a09n1esp?partner=rss,20/06/24
Espectáculos,La Jornada,Dan a conocer lista de nominados a Premios Ariel 2024,"La Academia Mexicana de Artes y Ciencias Cinematográficas (Amacc) dio a conocer a los nominados para la edición 66 de los Premios Ariel, que se efectuarán por segunda ocasión en Guadalajara, Jalisco.",https://www.jornada.com.mx/2024/06/20/espectaculos/a08n1esp?partner=rss,20/06/24
Nacional,La Jornada,Tremendo Jazz destaca el trabajo de músicos becarios del Injuve,"El desarrollo en el arte musical de una veintena de jóvenes oriundos de diferentes barrios con altos niveles de violencia que han encontrado en la música una salida a ese entorno, es reflejado en el documental Tremendo Jazz: sentenciados a la colaboración, que presentó ayer el Instituto de la Juventud (Injuve) en el Faro Cosmos.",https://www.jornada.com.mx/2024/06/20/capital/036n3cap?partner=rss,20/06/24
Nacional,La Jornada,Motosicarios desatan balacera en tianguis; un muerto y 3 heridos,"El ataque directo en un tianguis ubicado en cerrada de Fray Servando Teresa de Mier y callejón de San Antonio Abad, colonia Tránsito, alcaldía Cuauhtémoc, dejó una persona muerta, tres lesionadas e igual número de detenidas, informó la Secretaría de Seguridad Ciudadana (SSC).",https://www.jornada.com.mx/2024/06/20/capital/036n1cap?partner=rss,20/06/24
Nacional,La Jornada,Próxima Legislatura tendrá 20 representantes de población vulnerable,"El Congreso de la Ciudad de México recibió el acuerdo del Instituto Electoral local (IECM) sobre la designación de diputados que integrarán la tercera Legislatura, en la que habrá 20 escaños que representarán a núcleos de población vulnerable.",https://www.jornada.com.mx/2024/06/20/capital/034n2cap?partner=rss,20/06/24
Nacional,La Jornada,Caos por bloqueo del circuito interior,,https://www.jornada.com.mx/2024/06/20/capital/034n3cap?partner=rss,20/06/24
Nacional,La Jornada,Policía Cibernética alerta sobre el riesgo de usar wifi gratuito,"El uso de redes públicas con conexión inalámbrica a Internet puede representar riesgos significativos para la seguridad y privacidad de los usuarios, ya que son sujetos al robo de información, de datos sensibles o incluso a su identidad, alertó la Unidad de la Policía Cibernética.",https://www.jornada.com.mx/2024/06/20/capital/036n2cap?partner=rss,20/06/24
Nacional,La Jornada,Habilitan pozo para surtir de agua a barrio de Coyoacán,"Con una inversión de 14 millones de pesos, el Sistema de Aguas de la Ciudad de México (Sacmex) inició las obras de reposición de un pozo en Barrio del Niño Jesús, Coyoacán, que a partir de septiembre dotará 40 litros por segundo a 17 mil personas.",https://www.jornada.com.mx/2024/06/20/capital/035n1cap?partner=rss,20/06/24
Nacional,La Jornada,"Bar El Perro Salado funcionaba de forma clandestina, revela alcaldía","El bar El Perro Salado, de la colonia Tránsito, contra el que la Fiscalía General de Justicia (FGJ) abrió una carpeta de investigación por corrupción de menores, operaba de manera clandestina. De acuerdo con información oficial, el local no cuenta con ningún registro en la Unidad de Giros Mercantiles de la alcaldía Cuauhtémoc y tampoco en el Sistema Electrónico de Avisos y Permisos de Establecimientos Mercantiles.",https://www.jornada.com.mx/2024/06/20/capital/034n1cap?partner=rss,20/06/24
Nacional,La Jornada,Constructora de torre Mítikah incumple con obras de mitigación,"Habitantes del pueblo de Xoco carecen de agua potable en sus casas al menos tres veces por semana, además de que el suministro es por tandeo y en mínima cantidad, ya que hasta el momento no han recibido las obras de mitigación a las que se comprometió la empresa constructora de la torre Mítikah, reprochó el presidente de la asamblea ciudadana, Álvaro Antonio Rosales.",https://www.jornada.com.mx/2024/06/20/capital/035n2cap?partner=rss,20/06/24
Nacional,La Jornada,"Plan de protección civil, forzoso para estaciones del transporte público",Cada una de las estaciones de los servicios de transporte público –Metrobús y eléctricos (trolebús y Cablebús)– de la Ciudad de México deberán contar con programas de protección civil con el propósito de establecer los protocolos necesarios para la atención de emergencias en dichos lugares.,https://www.jornada.com.mx/2024/06/20/capital/035n3cap?partner=rss,20/06/24
Nacional,La Jornada,Bloquean el Arco Norte para exigir indemnización por tierras,"Ejidatarios de los estados de México, Hidalgo, Tlaxcala y Puebla mantienen desde hace dos días un bloqueo en la autopista Arco Norte, en protesta por la falta de indemnización de sus tierras, utilizadas hace 18 años para construir dicha vialidad.",https://www.jornada.com.mx/2024/06/20/estados/032n2est?partner=rss,20/06/24
Nacional,La Jornada,Rutilio Escandón y Edna Vega encabezan reunión para cierre del Programa Nacional de Reconstrucción,"En la reunión para el cierre del Programa Nacional de Reconstrucción con la subsecretaria de Ordenamiento Territorial y Agrario de la Secretaría de Desarrollo Agrario, Territorial y Urbano, Edna Vega Rangel, el gobernador Rutilio Escandón Cadenas celebró los resultados en beneficio del pueblo de Chiapas que fue afectado por el sismo de 2017. Durante el encuentro, agradeció a las autoridades federales por cumplir con esta responsabilidad y hacerlo con valor agregado, al tiempo de hacer una mención especial a David Cervantes Peredo, comisionado nacional para la reconstrucción que falleció en 2022 y quien, dijo, buscó siempre el bienestar de las y los chiapanecos.",https://www.jornada.com.mx/2024/06/20/estados/033n3est?partner=rss,20/06/24
Nacional,La Jornada,Desplazados de Tila exigen una base del Ejército y servicios,"San Cristóbal de Las Casas, Chis., Pobladores de Tila que el pasado 7 de junio abandonaron sus casas por la violencia que prevalece en el municipio participaron ayer en una “peregrinación por la vida y la paz”, realizada en Yajalón –donde se encuentran refugiados–, en la que exigieron a las autoridades condiciones de seguridad para regresar a sus hogares.",https://www.jornada.com.mx/2024/06/20/estados/033n1est?partner=rss,20/06/24
Nacional,La Jornada,Murieron tres menores en NL por las lluvias de Alberto,"Tres menores murieron en Nuevo León en medio de las primeras lluvias de la tormenta tropical Alberto, que obligaron al gobierno estatal a suspender todas las actividades, excepto en hospitales y albergues; mientras, la Secretaría de la Defensa Nacional aplicó el Plan DN-III-E, de auxilio a la población, en municipios del sur de Tamaulipas, ante la previsión de que el meteoro tocaría tierra la madrugada de este jueves en los límites de ese estado y Veracruz.",https://www.jornada.com.mx/2024/06/20/estados/031n1est?partner=rss,20/06/24
