Category,Source,Title,Content Summary,URL,Date of Publication
Deportes,La Jornada,Diablos Rojos femenil vence a Sultanes; enfrentará a Charros,"Diablos Rojos femenil empataron la última serie de la temporada regular en la Liga Mexicana de Softbol, al vencer en el segundo duelo a Sultanes de Monterrey por 9-5 en su visita a la Sultana del Norte. Las escarlatas enfrentarán a Charros de Jalisco en las semifinales que comenzarán en la Ciudad de México en el Parque Universitario de Beisbol de la UNAM mañana.",https://www.jornada.com.mx/2024/03/04/deportes/a12n3dep?partner=rss,04/03/24
Deportes,La Jornada,"Rayados, líder invicto, golea a Pumas","Monterrey y Pumas jugaron un partido con cierta anestesia, como si no se hubieran enterado que en el estadio BBVA miles de aficionados pagaron un boleto para celebrar a lo grande. Los primeros 45 minutos pasaron de largo. Y en los únicos momentos que cambiaron la noche, el mexicano-estadunidense Brandon Vázquez, el español Sergio Canales y Gerardo Arteaga le dieron el triunfo a los regiomontanos 3-0 en el cierre de la fecha 10 de la Liga Mx.",https://www.jornada.com.mx/2024/03/04/deportes/a09n2dep?partner=rss,04/03/24
Deportes,La Jornada,"México, imparable en la  Copa Oro W; va a semifinal","México sigue en un momento de algarabía en la Copa Oro W aunque debió enfrentar complejidades. Con una Jaqueline Ovalle que se ha convertido en pilar del plantel y ahora marcó un doblete, el tricolor femenil aseguró su pase a las semifinales del torneo donde enfrentarán a Brasil después de sortear un complicado encuentro para vencer 3-2 a Paraguay.",https://www.jornada.com.mx/2024/03/04/deportes/a09n1dep?partner=rss,04/03/24
Deportes,La Jornada,Paola Longoria alcanza su título 119 en el Abierto de Boston de raquetbol,"El legado de Paola Longoria en el raquetbol sigue extendiéndose. En el Abierto de Boston, la potosina logró un título más a un largo palmarés que supera la centena de trofeos.",https://www.jornada.com.mx/2024/03/04/deportes/a11n2dep?partner=rss,04/03/24
Deportes,La Jornada,Boston aplasta a Golden State con diferencia récord,"Los Celtics de Boston machacaron 140-88 a los Guerreros de Golden State en la tercera victoria más abultada de sus casi 80 años de historia en la NBA. Pese a la ausencia del estelar Kristaps Porzingis, el equipo del trébol afianzó su liderato en la Conferencia Este con 11 triunfos consecutivos. El escolta Jaylen Brown anotó 25 de sus 29 puntos en una frenética primera mitad, en la que los locales se adelantaron con asombroso marcador de 82-38, la mayor diferencia al descanso en la historia de la franquicia y, a su vez, el peor déficit de los Guerreros. Jayson Tatum contribuyó con 27 unidades y Stephen Curry, símbolo de Golden State, se quedó con sólo cuatro.",https://www.jornada.com.mx/2024/03/04/deportes/a30n1dep?partner=rss,04/03/24
Deportes,La Jornada,Los clavadistas mexicanos ratifican talento en Montreal,"Aplomo es la cualidad que han mostrado los clavadistas mexicanos en la Copa del Mundo que se realiza en Montreal, Canadá . Un rasgo que levanta expectativas rumbo a su participación en los Juegos Olímpicos en una jornada en la que la delegación tricolor agregó dos medallas más a su conteo.",https://www.jornada.com.mx/2024/03/04/deportes/a11n1dep?partner=rss,04/03/24
Deportes,La Jornada,"Inteligencia artificial  impacta en los deportes, coinciden especialistas",Boston. Los múltiples análisis avanzados que hay en el deporte están por medirse con un rival que los supera: la inteligencia artificial (IA).,https://www.jornada.com.mx/2024/03/04/deportes/a12n1dep?partner=rss,04/03/24
Deportes,La Jornada,"Como Acapulco, el bicampeón del Abierto Mexicano se reconstruyó","Acapulco, Gro., Cuando Alex de Miñaur llegó a Acapulco, arrastraba cuatro finales perdidas de manera consecutiva; una de sus peores rachas en el circuito ATP desde que se convirtió en profesional.",https://www.jornada.com.mx/2024/03/04/deportes/a12n2dep?partner=rss,04/03/24
Deportes,La Jornada,Santiago Giménez anota en el empate 2-2 del Feyenoord ante el PSV,"La Haya., El Feyenoord perdió una oportunidad para recortar distancia con el PSV, líder de la liga neerlandesa, ayer al empatar 2-2, en un duelo en el que el mexicano Santiago Giménez anotó para el equipo de Rotterdam, mientras su compatriota Hirving Chucky Lozano cumplió 100 partidos con el conjunto de Eindhoven.",https://www.jornada.com.mx/2024/03/04/deportes/a10n1dep?partner=rss,04/03/24
Deportes,La Jornada,"Mallorca, del Vasco Aguirre, a la final de la Copa del Rey","Madrid. El Mallorca, dirigido por el mexicano Javier Vasco Aguirre, venció 1-0 al Girona ayer en la jornada 27 de la Liga de España para acercarse a la permanencia en una semana perfecta tras lograr el pase a la final de la Copa del Rey.",https://www.jornada.com.mx/2024/03/04/deportes/a10n2dep?partner=rss,04/03/24
Deportes,La Jornada,Marlene Santos Alejo: Balance de la jornada,"En vísperas del Día de la Mujer    y a horas de que se apruebe en el Senado la Ley de Equidad Salarial, el Tri femenil está demostrando con su participación en la Copa Oro W que la medida es necesaria y es apenas un principio de justicia que debe triunfar por encima de la mezquindad de la Federación Mexicana de Futbol (FMF), cuyos directivos han retrasado la salida a la luz desde noviembre con argumentos insostenibles... Restarán otros pasos hacia la publicación de una norma que dé, al comienzo de sus carreras profesionales, suelo parejo a hombres y mujeres.",https://www.jornada.com.mx/2024/03/04/opinion/a10o1dep?partner=rss,04/03/24
Economía,La Jornada,Carlos Fernández-Vega: México SA,"Práctica común en tiempos de campaña    electoral –cualquiera que sea el cargo público al que se aspira– es que los candidatos todo prometen y ya en el ejercicio del hueso suelen incumplir todo, o cuando menos la parte medular del interminable paquete de “compromisos” y “ofertas” –notariadas y, ya en el ridículo, con sangre de por medio– adquiridos durante el proselitismo. Y ello sucede aquí, allá y acullá.",https://www.jornada.com.mx/2024/03/04/opinion/019o1eco?partner=rss,04/03/24
Economía,La Jornada,"Al sector energético, una de cada cuatro empresas atraídas por nearshoring","Una de cada cuatro firmas que han arribado a México por la relocalización de las cadenas globales de suministro, conocida como nearshoring, pertenecen al sector de energía, señaló Ricardo Ortega López, director general de Oil&amp;Gas Alliance.",https://www.jornada.com.mx/2024/03/04/economia/019n2eco?partner=rss,04/03/24
Economía,La Jornada,"En 2023, inversión de mexicanos en el extranjero disminuyó 55.7%","Durante el año pasado, los mexicanos invirtieron 6 mil 429 millones de dólares en proyectos de largo plazo en el extranjero. Ese monto –principalmente destinado a la ampliación de operaciones de empresas nacionales en América Latina, España, Francia, Alemania y Estados Unidos– representa una caída de más de 50 por ciento a tasa anual, revelan datos oficiales.",https://www.jornada.com.mx/2024/03/04/economia/016n1eco?partner=rss,04/03/24
Economía,La Jornada,Enrique Galván Ochoa: Dinero,"Hay personas interesadas en    que haya un rompimiento entre Claudia y Andrés Manuel. La tientan con preguntas como ésta: ¿eres una calca del López Obrador? En la concentración del Zócalo despejó dudas: defenderá su legado. Las diferencias habrá que buscarlas en la realidad. En días pasados tuvo Claudia una reunión con el sector de negocios, convocada por Francisco Cervantes, presidente del Consejo Coordinador Empresarial, y contestó preguntas sobre sus planes de gobierno y en particular acerca de su política en materia de energía verde. Su respuesta: es ambientalista, por lo tanto, partidaria de las energías verdes, sin demérito de la industria petrolera. Días después anunciaría en el Zócalo un programa de paneles solares para que las familias y los pequeños comercios generen su propia electricidad, lo cual se traduciría en un ahorro para su economía. López Obrador llegó a Palacio con el sector privado en contra, recuérdese que las organizaciones empresariales decían que era “un peligro para México”.",https://www.jornada.com.mx/2024/03/04/opinion/006o1eco?partner=rss,04/03/24
Economía,La Jornada,Congresistas de EU presentan acuerdo de financiamiento para el gobierno,"Washington. Los negociadores del Congreso de Estados Unidos revelaron un acuerdo detallado para mantener en funcionamiento a gran parte del gobierno hasta el 30 de septiembre, mientras se apresuran a evitar otra fecha límite de cierre de la administración antes del viernes.",https://www.jornada.com.mx/2024/03/04/economia/017n2eco?partner=rss,04/03/24
Economía,La Jornada,León Bendesky: Un ángulo en política monetaria,"El dilema de la política    monetaria en la Reserva Federal (FED) está dado, en general, por la confrontación de las condiciones del crecimiento económico y del empleo frente al comportamiento de la inflación, cuyo nivel está fijado en 2 por ciento anual.",https://www.jornada.com.mx/2024/03/04/economia/017a1eco?partner=rss,04/03/24
Economía,La Jornada,David Márquez Ayala: Reporte económico,"La crisis pandémica    global de 2020 nos dejó en México con una interrogante: ¿cómo se habría comportado la economía en transformación de no haberse dado el colapso? Como un acercamiento para fines comparativos, sacamos la tasa promedio de crecimiento de los años cuarto y quinto de cada sexenio en lo que va del siglo, con la nueva base 2018: 2004-05, 2.84; 2010-11, 4.21; 2016-17, 1.82; y 2022-23, 3.59%; esto es, se tuvo un buen desempeño en el actual gobierno.",https://www.jornada.com.mx/2024/03/04/opinion/018o1eco?partner=rss,04/03/24
Economía,La Jornada,La subocupación entre mujeres aumentó en enero,"En el arranque del año, la subrepresentación que viven las mujeres en el mercado laboral mexicano se vio rebasada por la necesidad y disponibilidad de trabajar más. En contrasentido de lo registrado entre hombres, en enero las trabajadoras buscaron laborar más horas, según información del Instituto Nacional de Estadística y Geografía (Inegi).",https://www.jornada.com.mx/2024/03/04/economia/017n1eco?partner=rss,04/03/24
Economía,La Jornada,Pemex ha recuperado gran parte de ventas en el mercado interno,"En los últimos tres años Petróleos Mexicanos (Pemex) ha recuperado gran parte de ventas en el mercado interno hasta alcanzar los niveles previos a la pandemia. Registra una mayor comercialización de gasolinas, diésel y gas licuado de petróleo (LP), según datos de la empresa estatal.",https://www.jornada.com.mx/2024/03/04/economia/019n1eco?partner=rss,04/03/24
Economía,La Jornada,"Este año, nuestro país será noveno productor mundial de agroalimentos","Para 2024, México avanzará un peldaño y se convertirá en el noveno mayor productor de agroalimentos del mundo, al tiempo que subirá dos escalones para ocupar la séptima posición entre los mayores exportadores de comida, revela el reporte anual Perspectivas Agroalimentarias 2024.",https://www.jornada.com.mx/2024/03/04/economia/016n2eco?partner=rss,04/03/24
Economía,La Jornada,Sectur: feriados de marzo dejarán derrama por 48 mil 381 millones de pesos,"El segundo fin de semana largo del año, que será del 15 al 18 de marzo, dejará una derrama económica por consumo de servicios turísticos de 48 mil 381 millones de pesos, prevé la Secretaría de Turismo (Sectur).",https://www.jornada.com.mx/2024/03/04/economia/018n1eco?partner=rss,04/03/24
Economía,La Jornada,OPEP+ extiende recortes a producción de crudo hasta segundo trimestre,"La Organización de Países Exportadores de Petróleo y sus aliados (OPEP+) anunciaron que ampliarán los recortes voluntarios a la producción de crudo hasta el segundo trimestre del año, lo que supone más apoyo para un mercado preocupado por las perspectivas de crecimiento económico mundial.",https://www.jornada.com.mx/2024/03/04/economia/018n2eco?partner=rss,04/03/24
Economía,Expansión,Las mujeres ganan 7.7 dólares por cada 10 que reciben los hombres en el mundo,"Las mujeres en el mundo acceden solo al 64% de la protección legal que ampara a los hombres, informa el Banco Mundial.",https://expansion.mx/economia/2024/03/04/mujeres-ganan-menos-que-hombres,04/03/24
Economía,Expansión,"Consumo privado avanza 0.2% en diciembre, desacelera el paso","De acuerdo con analistas, el incremento es más a lo estimado por el Indicador Oportuno del Consumo Privado.",https://expansion.mx/economia/2024/03/04/consumo-privado-avanza-0-2-en-diciembre-desacelera-paso,04/03/24
Economía,Expansión,La gasolina Premium suma cuatro meses sin subsidio,"Desde noviembre, este combustible no ha gozado de estímulo fiscal, a diferencia de la Magna y el diésel.",https://expansion.mx/economia/2024/03/04/gasolina-premium-suma-cuatro-meses-sin-subsidio,04/03/24
Economía,Expansión,OPEP acuerda extender recorte de producción hasta finales de junio,"Con la medida, las naciones productoras pretenden elevar el precio de la materia prima.",https://expansion.mx/economia/2024/03/03/opep-acuerda-recorte-produccion-finales-junio,03/03/24
Economía,Expansión,La reunión de la OMC cierra sin acuerdos en pesca y agricultura,"La directora general del organismo, Ngozi Okonjo-Iweala, destacó que la reunión tuvo lugar ""contra un trasfondo internacional marcado por la mayor incertidumbre de cualquier tiempo que se recuerde"".",https://expansion.mx/economia/2024/03/02/reunion-de-omc-cierra-sin-acuerdos-en-pesca-y-agricultura,02/03/24
Economía,Expansión,Monte de Piedad logra acuerdo con sindicato,El contrato colectivo de trabajo será sometido a votación de los trabajadores.,https://expansion.mx/economia/2024/03/01/monte-de-piedad-logra-acuerdo-con-sindicato,02/03/24
Economía,Expansión,"No solo BBVA, NU México presenta fallas hoy para hacer transferencias",Algunos usuarios reportaron problemas al momento de querer realizar transferencias.,https://expansion.mx/economia/2024/03/01/nu-mexico-presenta-fallas-hoy,01/03/24
Economía,Expansión,Ingresos petroleros y tributarios quedan por debajo de sus metas en enero,En el reporte de Hacienda se observó un crecimiento de 28.6% en el gasto programable.,https://expansion.mx/economia/2024/03/01/ingresos-tributarios-petroleros-no-logran-meta-hacienda,01/03/24
Economía,Expansión,Hacienda reduce el subsidio al diésel,"La cuota por el impuesto IEPS será de 6.08 pesos por litro; para el diésel, un monto mayor al de la semana que termina este viernes, de 5.79 pesos por litro.",https://expansion.mx/economia/2024/03/01/hacienda-reduce-subsidio-al-diesel-precio-gasolina,01/03/24
Economía,Expansión,Analistas privados reducen expectativa de inflación,"Para el 2024, analistas consultados por el Banco de México (Banxico) esperan que la inflación cierre el año en una tasa de 4.10%, desde un 4.17% previo.",https://expansion.mx/economia/2024/03/01/analistas-privados-reducen-expectativa-de-inflacion,01/03/24
Economía,Expansión,BBVA reporta fallas en sus sistemas,El banco informó a sus usuarios que sus sistemas presentaban fallas sin especificar si sólo era la app o también en sucursales.,https://expansion.mx/economia/2024/03/01/bbva-falla-app,01/03/24
Economía,Expansión,"Las remesas se desaceleran en enero y llegan a 4,574.6 mdd","En el primer mes de este año, las remesas que llegaron a México cayeron 16.8% en comparación con el mes previo.",https://expansion.mx/economia/2024/03/01/remesas-se-desaceleran-enero-2024,01/03/24
Economía,Expansión,Finamex busca capitalizar el nearshoring,"Una de las principales casas de bolsa en México pretende aprovechar esta tendencia, al tiempo que atrae a pequeños inversionistas.",https://expansion.mx/economia/2024/03/01/finamex-aprovechar-nearshoring-mexico,01/03/24
Economía,Expansión,"México arranca el año con 52 anuncios de inversión por casi 26,000 mdd",El 62% de los anuncios de inversión corresponde a la industria del sector manufacturero.,https://expansion.mx/economia/2024/02/29/mexico-arranca-el-ano-con-52-anuncios-de-inversion-por-casi-26-000-mdd,01/03/24
Economía,Expansión,Trabajadores de Monte de Piedad votarán por continuidad de huelga,"En caso de no llegar a un acuerdo entre la administración y el sindicato de Monte de Piedad esta semana, los trabajadores decidirán si continúa o se levanta la huelga.",https://expansion.mx/economia/2024/02/29/trabajadores-monte-piedad-votaran-huelga,29/02/24
Economía,Expansión,"En 17 años, participación económica de mujeres en México ha pasado de 43 a 46%",El IMCO apunta que en el país la participación de las mujeres en la economía tiene un retraso importante respecto al promedio de la OCDE.,https://expansion.mx/economia/2024/02/29/participacion-economica-mujer-mexico-aumento-3-en-17-anos,29/02/24
Economía,Expansión,"Se pensionan 72,623 mexicanos con tasa de reemplazo del 72%: Consar","De enero de 2021 a diciembre pasado, 63,360 personas han logrado pensionarse gracias a la reducción de las semanas cotizadas.",https://expansion.mx/economia/2024/02/29/mas-72-623-mexicanos-pensionan-72-ultimo-salario-consar,29/02/24
Economía,Expansión,No por mérito propio: Millennials serán la generación más rica de la historia,"Ahora, lo importante es cómo gastarán en invertirán las grandes fortunas que heredarán en países como Estados Unidos. El cambio generacional de la riqueza redefinirá el rumbo de los negocios.",https://expansion.mx/economia/2024/02/29/illennials-seran-generacion-mas-rica-historia,29/02/24
Economía,Expansión,La digitalización pone a competir a fintech y bancos: Hacienda,"Roberto Lazzeri, Jefe de la Oficina del Secretario de Hacienda, señala que la llegada de empresas de tecnología financiera ayuda a la competencia en favor de los usuarios.",https://expansion.mx/economia/2024/02/29/digitalizacion-pone-a-competir-a-fintech-y-bancos-hacienda,29/02/24
Economía,Expansión,La industria farmacéutica mexicana puede prosperar más con el nearshoring,"Hay mano de obra calificada, costos competitivos e infraestructura para propiciar el nearshoring en la industria farmacéutica y de dispositivos médicos.",https://expansion.mx/economia/2024/02/29/industria-farmaceutica-prosperar-nearshoring,29/02/24
Economía,Expansión,"Banco de México perfila ""ajuste fino"" en el recorte a la tasa","El subgobernador Jonathan Heath dijo que sería un ""error"" bajar la tasa prematuramente sin haber ganado la batalla contra la inflación; sin embargo, dijo que podría haber un ajuste.",https://expansion.mx/economia/2024/02/29/seria-un-error-bajar-tasa-de-interes-jonathan-heath,29/02/24
Economía,Expansión,Inflación en EU aumenta en enero en línea con lo previsto,"El índice de precios de los gastos de consumo personal (PCE) subió un 0.3% el mes pasado, informó el jueves la Oficina de Análisis Económico del Departamento de Comercio.",https://expansion.mx/economia/2024/02/29/inflacion-estados-unidos-enero-2024,29/02/24
Economía,Expansión,"7 de cada 10 personas invierten después del ""hubiera ahorrado""","Carlos Marmolejo, director general de la Sofipo Finsus, dijo que con GameIf buscan educar de manera didáctica a los usuarios incentivando el ahorro y las inversiones.",https://expansion.mx/economia/2024/02/29/finsus-fomentar-ahorro-gameif,29/02/24
Economía,Expansión,La deuda mexicana se va en pago de pensiones,"Para 2024 se aprobó un techo de deuda de 1.9 bdp, mientras se prevé un gasto en pensiones por 1.500 bdp, y 465,000 mdp para el programa de pensiones para adultos mayores.",https://expansion.mx/economia/2024/02/29/la-deuda-mexicana-se-va-en-pago-de-pensiones,29/02/24
Economía,Expansión,Impuestos quedan por debajo de lo esperado en 4 de 5 años de gobierno,México Evalúa advierte sobre la baja generación de recursos públicos por renta petrolera. Los ingresos totales quedaron por debajo de su meta en 2020 y 2023.,https://expansion.mx/economia/2024/02/28/recaudacion-impuestos-gobierno-amlo-debajo-meta,28/02/24
Economía,Expansión,El porcentaje de pobreza laboral anota su segunda menor tasa desde 2008,"De acuerdo con el Coneval, en el último trimestre de 2023, las entidades con menor porcentaje de pobreza laboral fueron Baja California Sur, Baja California y Jalisco.",https://expansion.mx/economia/2024/02/28/pobreza-laboral-baja-2023-pero-mujeres-son-mas-vulnerables,28/02/24
Economía,Expansión,Banxico reduce pronósticos para la economía mexicana a 2.8%,El Banco de México (Banxico) pronostica que el PIB de México crecerá menos de lo esperado este 2024 y mantuvo sus pronósticos para 2025.,https://expansion.mx/economia/2024/02/28/banxico-pronostico-crecimiento-economia-mexicana,28/02/24
Economía,Expansión,Los banqueros preparan Convención en Acapulco pese a recuperación desigual,La 87 Convención Bancaria se celebrará en Acapulco y contará con la presencia del presidente López Obrador y a los tres aspirantes a la presidencia.,https://expansion.mx/economia/2024/02/28/amlo-candidatos-a-presidencia-en-convencion-bancaria-2024,28/02/24
Economía,Expansión,Crecimiento económico de EU en el cuarto trimestre se revisa a la baja,"El Producto Interno Bruto aumentó a una tasa anualizada del 3.2%, revisada ligeramente a la baja desde el ritmo del 3.3%.",https://expansion.mx/economia/2024/02/28/crecimiento-economico-eu-cuarto-trimestre-se-revisa-a-la-baja,28/02/24
Economía,Expansión,Hacienda congela contrataciones en el gobierno federal,La disposición se aplicará del 2 de marzo al 30 de septiembre de este año; el dinero del que se dispone por las plazas vacantes deberá ser devuelto al ramo de Provisiones Salariales y Económicas.,https://expansion.mx/economia/2024/02/28/hacienda-congela-contrataciones-gobierno-federal,28/02/24
Economía,Expansión,Hacienda prevé que deuda llegue a 48.8% del PIB este año,El subsecretario de Hacienda señala que el país no requiere de una reforma tributaria para poder solventar desequilibrios fiscales.,https://expansion.mx/economia/2024/02/28/hacienda-preve-que-deuda-llegue-a-48-8-del-pib-este-ano,28/02/24
Economía,Expansión,inDrive lanza división financiera con tarjeta de crédito y préstamos personales,"Tras una alianza con firmas como Galileo, Mastercard, entre otros, la plataforma de movilidad ofrecerá créditos de hasta 15,000 pesos.",https://expansion.mx/economia/2024/02/28/indrive-money-tarjeta-de-credito,28/02/24
Economía,Expansión,El SAT duplica la recaudación por fiscalizar operaciones de comercio exterior,"En los primeros cinco años del gobierno, la autoridad fiscal ha puesto el ojo en las operaciones para internar y enviar mercancías al extranjero. Hay errores que derivan en créditos millonarios.",https://expansion.mx/economia/2024/02/28/sat-fiscalizacion-comercio-exterior,28/02/24
Economía,Expansión,Aranceles al acero presionan más a EU que a México,"En una guerra de aranceles al acero, Estados Unidos tiene la de perder, declaró Raquel Buenrostro, secretaria de Economía.",https://expansion.mx/economia/2024/02/27/aranceles-acero-estados-unidos-mexico,28/02/24
Economía,Expansión,"El tema energético con Estados Unidos ya se resolvió, asegura Raquel Buenrostro",La titular de Economía explicó que todos los temas por los que había una diferencia en materia energética -electricidad y de hidrocarburos- entre México y EU quedaron resueltos.,https://expansion.mx/economia/2024/02/27/mexico-eu-resolvieron-conflicto-energetico-buenrostro,28/02/24
Economía,Expansión,"Banco del Bienestar supera meta y llega a 3,149 sucursales","La dependencia informó que 2,750 sucursales fueron construidas exclusivamente por la Secretaría de la Defensa (Sedena).",https://expansion.mx/economia/2024/02/27/cuantas-sucursales-tiene-banco-bienestar,27/02/24
Economía,Expansión,Los Cetes a 28 días dan por descontado recorte de Banxico,Los Cetes de corto plazo se mantuvieron por segunda semana consecutiva con tasa del 11% mientras que los Cetes a dos años bajaron a su nivel más bajo desde enero.,https://expansion.mx/economia/2024/02/27/cetes-corto-plazo-mantienen-rendimiento-recorte-tasa-banxico,27/02/24
Economía,Expansión,La OCDE ve oportunidad para recaudar más impuestos en México,"De acuerdo con el Estudio Económico sobre México, la recaudación de impuestos representa apenas el 16.7% del producto interno bruto (PIB), la mitad del promedio de los países de la OCDE.",https://expansion.mx/economia/2024/02/27/la-ocde-ve-oportunidad-para-recaudar-mas-impuestos-en-mexico,27/02/24
Economía,Expansión,¿Quién es Luis Niño de Rivera? Uno de los fundadores de Banco Azteca,"El banquero que ha anunciado su retiro de Banco Azteca tras 20 años de servicio, fue también en su juventud clavadista olímpico.",https://expansion.mx/economia/2024/02/27/quien-es-luis-nino-de-rivera-banco-azteca,27/02/24
Economía,Expansión,Las exportaciones mexicanas caen en enero,"Durante el primer mes de 2024, las ventas de México al extranjero registraron una disminución de 1.5% a tasa anual.",https://expansion.mx/economia/2024/02/27/mexico-balanza-comercial-importaciones-exportaciones-inegi,27/02/24
Economía,Expansión,Las altas tasas de interés presionan a Sofomes y Sofipos,"Al no obtener financiamiento de la misma manera de la banca, la temporada de altas tasas ha repercutido en el fondeo de instituciones financieras no bancarias (IFNB).",https://expansion.mx/economia/2024/02/27/las-altas-tasas-de-interes-presionan-a-sofomes-y-sofipos,27/02/24
