Category,Source,Title,Content Summary,URL,Date of Publication
Tendencias,Expansión,¿Quién inventó la Ley Seca y cuándo se implementó por primera vez en México?,"Para conocer el origen de la Ley Seca hay que retroceder más de un siglo en la historia. Descubre cómo surgió, quién la impulsó originalmente y cómo se extendió a otros lugares.",https://expansion.mx/tendencias/2024/06/03/quien-invento-ley-seca-origen,04/06/24
Tendencias,Expansión,¿Por qué se celebra el Día Mundial del Medio Ambiente y cuándo es?,En junio se celebra el el Día Mundial del Medio Ambiente. Conoce cuándo cae en 2024 y por qué se conmemora esta fecha.,https://expansion.mx/tendencias/2024/06/03/dia-mundial-del-medio-ambiente-cuando-es,03/06/24
Tendencias,Expansión,Otra tormenta solar apunta a la Tierra con nuevas auroras boreales,También se espera un 60% de probabilidades de que afecte las comunicaciones por radio en Estados  Unidos.,https://expansion.mx/tendencias/2024/05/28/vuelven-auroras-boreales-nueva-tormenta-solar-apunta-tierra,28/05/24
Tendencias,Expansión,¿Cuándo entra el solsticio de verano 2024 en México?,"Te decimos cuándo entra el solsticio de verano de 2024 en México, el día más largo y la noche más corta del año.",https://expansion.mx/tendencias/2024/05/28/cuando-entra-solsticio-de-verano-2024,28/05/24
Tendencias,Expansión,¿Qué es un halo solar y es peligroso para la salud?,"Conoce qué son los halos solares y si son peligrosos para la salud, así como las causas de su formación.",https://expansion.mx/tendencias/2024/05/28/que-es-halo-solar-es-peligroso,28/05/24
Tendencias,Expansión,"Las promociones por Día de la Hamburguesa en Burger King, McDonald's y Carl's Jr","El Día de la Hamburguesa es hoy, y podrás celebrarlo con distintas promos. Aquí te damos los detalles.",https://expansion.mx/tendencias/2024/05/28/promociones-dia-de-la-hamburguesa,28/05/24
Tendencias,Expansión,Eventos astronómicos de junio 2024: ¿Cuándo es la luna llena de fresa en México?,Conoce los eventos astronómicos de junio 2024 para poder apreciar el cielo nocturno de México. Este mes será la luna de fresa.,https://expansion.mx/tendencias/2024/05/27/eventos-astronomicos-junio-2024,27/05/24
Tendencias,Expansión,"Muere Kabosu, ícono de la criptomoneda Dogecoin","Kabosu, la perrita japonesa de raza shiba inu, famosa por ser la protagonista de varios memes virales y que inspiró el logo de la criptomoneda Dogecoin, murió este viernes en Japón.",https://expansion.mx/tendencias/2024/05/24/muere-kabosu-perrita-meme-criptomoneda-dogecoin,24/05/24
Tendencias,Expansión,¿Es seguro descongelar y congelar la carne una y otra vez?,"Cuidado, si repites este procedimiento de forma incorrecta podría haber E. coli y salmonella en tus alimentos, según los expertos.",https://expansion.mx/tendencias/2024/05/21/cuantas-veces-se-puede-descongelar-la-carne,21/05/24
Tendencias,Expansión,¿Ya tienes tus boletos para Luis Miguel?,Aprovecha la preventa Banorte y compra tus boletos para los conciertos del 20 y 21 de octubre en la Arena Ciudad de México.,https://expansion.mx/tendencias/2024/05/17/preventa-banorte-luis-miguel-2024,17/05/24
Tendencias,Expansión,"La tirolesa más visitada del mundo está en Xplor, Riviera Maya","Xplor, el mejor parque de aventura de la Riviera Maya ofrece una gran experiencia con circuito de tirolesas, coches anfibios para explorar la selva, ríos naturales subterráneos, tobogán 5 en 1 y más.",https://expansion.mx/tendencias/2024/05/15/la-tirolesa-mas-visitada-del-mundo-esta-en-xplor-riviera-maya,16/05/24
Tendencias,Expansión,¿Es normal que los niños tengan canas o es una señal de alerta?,"La aparición de canas en adultos es lo más normal del mundo, pero ¿qué pasa cuando se trata de niños? ¿Es motivo de preocupación? Aquí te explicamos.",https://expansion.mx/tendencias/2024/05/15/canas-en-ninos-es-normal,15/05/24
Tendencias,Expansión,¿Cuándo es el Día de la Familia 2024 y por qué se celebra?,"En marzo es cuándo se celebra el Día Nacional de la Familia, aunque a nivel internacional es en mayo. Conoce cuándo cae en 2024 y por qué se conmemora esta fecha.",https://expansion.mx/tendencias/2024/05/15/dia-de-la-familia-2024,15/05/24
Tendencias,Expansión,¿Por qué el ajolote está en peligro de extinción y qué pasa si desaparece?,"El ajolote está considerado en peligro crítico de extinción, según la Unión Internacional por la Conservación de la Naturaleza.",https://expansion.mx/tendencias/2024/05/14/por-que-el-ajolote-esta-en-peligro-de-extincion,14/05/24
Tendencias,Expansión,"Xavage, el parque ideal para los fanáticos de la aventura",En este parque de aventura todo incluido vivirás las experiencias más increíbles con tus seres queridos.,https://expansion.mx/tendencias/2024/05/14/xavage-el-parque-ideal-para-los-fanaticos-de-la-aventura,14/05/24
Tendencias,Expansión,"Muere Alice Munro, premio Nobel de Literatura 2013","Alice Munro ganó el Nobel de Literatura en 2013, siendo la primera autora canadiense en conseguirlo.",https://expansion.mx/tendencias/2024/05/14/muere-alice-munro-premio-nobel-de-literatura-2013,14/05/24
Tendencias,Expansión,Muere paciente que recibió trasplante de un riñón de cerdo,"El riñón de cerdo utilizado fue aportado por la empresa de biotecnología de Massachusetts eGenesis, que lo modificó genéticamente para eliminar los genes nocivos y agregarle otros humanos.",https://expansion.mx/tendencias/2024/05/13/muere-paciente-que-recibio-trasplante-de-un-rinon-de-cerdo,13/05/24
Tendencias,Expansión,¿Qué es una tormenta geomagnética y cómo te afecta?,Una enorme tormenta solar que se aproxima a la Tierra podría causar disrupciones en la red de energía y las comunicaciones.,https://expansion.mx/tendencias/2024/05/11/tormenta-geomagnetica-que-es,11/05/24
Tendencias,Expansión,La tormenta geomagnética deja ver auroras boreales en el mundo,La primera tormenta solar en 20 años esta provocando que desde Gran Bretaña hasta Argentina presencien fenómenos naturales hasta cortes de energía y telecomunicaciones.,https://expansion.mx/tendencias/2024/05/11/efectos-tormenta-solar-extrema,11/05/24
Tendencias,Expansión,Hay alerta por tormenta geomagnética hoy: ¿cuáles son sus efectos?,"Este tipo de fenómenos pueden causar afectaciones potenciales en las comunicaciones, la red eléctrica, la navegación, las operaciones de radio y satélites.",https://expansion.mx/tendencias/2024/05/10/tormenta-geomagnetica-hoy-efectos,10/05/24
Tendencias,Expansión,Caleidoscopio busca cortometrajes que retraten a la comunidad en la frontera,"Entérate cómo puedes concursar para retratar tu comunidad en la frontera y ganar hasta 5,000 dólares.",https://expansion.mx/tendencias/2024/05/10/festival-caleidoscopio-busca-cortometrajes-de-la-frontera,10/05/24
Tendencias,Expansión,Esto es lo que debes saber si tienes la piel hipersensible,"Diversas razones pueden dañar la piel hipersensible, por lo que lo ideal es mantener una rutina adecuada para cuidarla, como lo explicó Yunive Angulo, durante el podcast Health Café.",https://expansion.mx/tendencias/2024/05/07/esto-es-lo-que-debes-saber-si-tienes-la-piel-hipersensible,07/05/24
Tendencias,Expansión,¿Se trabaja el 10 de mayo o es festivo oficial por ser día de las madres?,El 10 de mayo se festeja el Día de las Madres en México y cabe la duda: ¿se trabaja o se puede descansar ese día? Esto dice la LFT al respecto,https://expansion.mx/tendencias/2024/05/07/10-de-mayo-se-trabaja-mexico-2024,07/05/24
Tendencias,Expansión,Así puedes ver el primer vuelo tripulado de la nave espacial Starliner de Boeing,No te pierdas todos los detalles del primer vuelo de la Starliner de Boeing. Te decimos a qué hora y en dónde ver el evento en vivo.,https://expansion.mx/tendencias/2024/05/06/donde-ver-primer-vuelo-tripulado-starliner-boeing,07/05/24
Tendencias,Expansión,La escritora mexicana Cristina Rivera Garza gana el Pulitzer 2024,"La escritora mexicana Cristina Rivera Garza es ganadora del premio Pulitzer 2024 por su libro ""El invencible verano de Liliana"".",https://expansion.mx/tendencias/2024/05/06/cristina-rivera-garza-gana-premio-pulitzer,06/05/24
Tendencias,Expansión,¿Qué es y para qué sirve la caja negra de un avión?,Seguro has escuchado hablar de las cajas negras de los aviones. ¿Sabes de qué color son en realidad y de qué están hechas? Aquí lo que debes saber.,https://expansion.mx/tendencias/2024/05/06/de-que-color-es-la-caja-negra-de-los-aviones,06/05/24
Tendencias,Expansión,"Muere César Luis Menotti, uno de los grandes del futbol argentino, a los 85 años","El ""Flaco"", quien aún era directivo, llevó a la Selección argentina de futbol a ganar el mundial de 1978, que se celebró en el país sudamericano.",https://expansion.mx/tendencias/2024/05/05/muere-cesar-luis-menotti,05/05/24
Tendencias,Expansión,Canelo Álvarez vs. Jaime Munguía: 10 datos clave de la pelea del 4 de mayo,"Por primera vez desde 2017, el campeón supermediano Saúl Canelo Álvarez enfrentará a un rival mexicano, en una cita enmarcada en las festividades del 5 de Mayo.",https://expansion.mx/tendencias/2024/05/03/canelo-alvarez-vs-jaime-munguia-datos-pelea-4-de-mayo,03/05/24
Tendencias,Expansión,¿Cuándo es luna llena en mayo 2024? Todos los eventos astronómicos del mes,"Te decimos cuándo cae luna llena mayo 2024, de acuerdo con el calendario lunar y todos los eventos astronómicos que habrá durante el mes.",https://expansion.mx/tendencias/2024/05/03/luna-llena-eventos-astronomicos-mayo-2024,03/05/24
Tendencias,Expansión,¿Cuándo es la lluvia de estrellas de las Acuáridas y cómo verlas en México?,"Una de las características más importantes de esta lluvia de estrellas es la velocidad de los meteoritos, que alcanza los 66 kilómetros por hora en su deslizamiento por la atmósfera terrestre.",https://expansion.mx/tendencias/2024/05/02/cuando-lluvia-estrellas-acuaridas-mayo,02/05/24
Tendencias,Expansión,¿Es dañino o saludable cocinar con freidora de aire?,Las freidoras de aire han cobrado gran popularidad en los últimos años. ¿Es beneficioso para la salud cocinar con este aparato o todo lo contrario?.,https://expansion.mx/tendencias/2024/05/02/freidora-de-aire-es-saludable-o-danina,02/05/24
Emprendimiento,Expansión,Banorte presenta una cuenta con inversión para fortalecer a las PyME,"Los emprendedores ahora cuentan con herramientas financieras para fortalecer sus recursos económicos, incrementar su capital y llevar a sus empresas al siguiente nivel.",https://expansion.mx/emprendedores/2024/04/24/banorte-presenta-una-cuenta-con-inversion-para-fortalecer-a-las-pyme,24/04/24
Emprendimiento,Expansión,"¿Calor y negocios?: Bahama Heladería, un modelo de franquicia con rápido retorno",Este tipo de franquicia de venta de helados garantiza a los emprendedores un retorno de inversión en un promedio de 12 a 14 meses.,https://expansion.mx/emprendedores/2024/04/06/modelo-de-franquicia-con-rapido-retorno,06/04/24
Emprendimiento,Expansión,"Las tienditas pueden competir con Oxxo, pero esto es lo que les hace falta",Las tiendas sí son del barrio y tienen ventajas sociales que negocios como Oxxo carecen. Las startups ofrecerán tecnologías para incrementar la productividad y ganar la batalla por la esquina.,https://expansion.mx/emprendedores/2024/04/03/como-tienditas-podrian-comerle-el-mandado-a-oxxo,03/04/24
Emprendimiento,Expansión,Las emprendedoras también enfrentan la brecha digital,"Las mujeres crean menos empresas de base tecnológica que los hombres y usan menos la tecnología, según la Radiografía del Emprendimiento en México 2023, Edición Mujeres, elaborada por la (ASEM).",https://expansion.mx/emprendedores/2024/02/08/emprendedoras-usan-menos-tecnologia,08/02/24
Emprendimiento,Expansión,Así puedes obtener un crédito para emprender sin fracasar en el intento,Uno de los factores que más limita a las empresas a acceder a créditos es la cantidad y dificultad de los trámites.,https://expansion.mx/emprendedores/2024/02/07/obtener-un-credito-para-emprender,07/02/24
Emprendimiento,Expansión,"500 Global busca startups para financiarlas con 300,000 dólares",El fondo de inversión aumenta su oferta y renueva su enfoque de acompañamiento para darles más tiempo a las compañías de consolidar los fundamentos de negocio.,https://expansion.mx/emprendedores/2024/02/06/500-global-startups-latinoamerica-financiar-300-000-dolares,06/02/24
Emprendimiento,Expansión,"Si eres empresario, ¿es obligatorio pertenecer a la Canaco?",Si eres dueño de una empresa debes saber si es obligatorio pertenecer a la Canaco y si es necesario estar en el registro del Sistema de Información Empresarial Mexicano. Te explicamos.,https://expansion.mx/emprendedores/2024/01/19/es-obligatorio-pertenecer-a-la-canaco,19/01/24
Emprendimiento,Expansión,500 Global lanza su cuarto fondo de inversión para startups en América Latina,"500 LatAm Seed IV se enfocará en las fortalezas, necesidades y oportunidades que hay en la región con nuevas miras en la Inteligencia Artificial.",https://expansion.mx/emprendedores/2024/01/17/500-global-cuarto-fondo-de-inversion-startups-latam,17/01/24
Emprendimiento,Expansión,Cómo conseguir financiamiento de forma creativa si eres mujer emprendedora,La líder de mercadotecnia de Gamesa y la fundadora de Quincus dan sus consejos para incentivar el emprendimiento entre las mujeres mexicanas.,https://expansion.mx/emprendedores/2023/11/19/dia-mujer-emprendedora-consejos-ideas-negocio-creativas,19/11/23
Emprendimiento,Expansión,Firma de venture capital '500 global' invierte en seis nuevas startups mexicanas,"A través del programa Somos lucha, brindará soporte personalizado en todos los aspectos del negocio, como producto, recaudación de fondos, crecimiento y administración, durante 16 semanas.",https://expansion.mx/emprendedores/2023/10/26/venture-capital-500-global-confia-seis-startups-mexicanas,26/10/23
Emprendimiento,Expansión,Toyota Corolla Cross HEV 2023: Emprendimiento en el mundo automotriz,El nuevo Toyota Corolla Cross HEV 2023 rompe lo establecido para crear nuevas posibilidades,https://expansion.mx/emprendedores/2023/09/29/toyota-corolla-cross-hev-2023-emprendimiento-en-el-mundo-automotriz,29/09/23
Emprendimiento,Expansión,El Multinational MBA: Un programa global único en Latinoamérica,La Escuela de Negocios de la Universidad Adolfo Ibáñez cuenta con el programa Multinational MBA para transformar a los directivos en verdaderos líderes globales.,https://expansion.mx/emprendedores/2023/08/03/el-multinational-mba-un-programa-global-unico-en-latinoamerica,03/08/23
Emprendimiento,Expansión,Invariantes levanta fondo de 30 mdd para startups latinoamericanas y de EU,"El venture capital latinoamericano, basado en Guatemala, tiene un modelo híbrido de inversión, con casos de éxito como Kubo Financiero.",https://expansion.mx/emprendedores/2023/07/14/invariantes-venture-capital-30-mdd-startups-latinoamerica-eu,14/07/23
Emprendimiento,Expansión,"Clivi, clínica digital enfocada en diabetes, levanta 10 mdd de capital semilla","Ricardo Moguel, su cofundador y exdirector general de Doctoralia en México, donde se conoció parte del equipo de la start-up, señala que el objetivo es llegar a un millón de pacientes en cinco años.",https://expansion.mx/emprendedores/2023/06/20/clivi-clinica-digital-diabetes-10-mdd-capital-semilla,20/06/23
Emprendimiento,Expansión,El exdirector ejecutivo de SoftBank lanza un fondo para emprendedores en AL,"Marcelo Claure lanzó Bicycle Capital, una nueva firma de capital de riesgo para emprendedores enfocada en América Latina, y cuyo primer fondo tendrá un inversión de 500 mdd.",https://expansion.mx/emprendedores/2023/06/14/exdirector-ejecutivo-softbank-lanza-fondo-emprendedores-al,14/06/23
Emprendimiento,Expansión,nocnoc levanta 14 mdd para su expansión en México y América Latina,"La ronda de financiamiento Serie A, liderada por PayPal Ventures, le servirá a la empresa para consolidarse y expandirse en la región.",https://expansion.mx/emprendedores/2023/06/12/nocnoc-planea-consolidarse-mexico-ronda-de-inversion,12/06/23
Emprendimiento,Expansión,Crisis de financiamiento: ¿Puede la IA salvar a las startups de Latinoamérica?,"En mayo, la captación de fondos de las startups en América Latina cayó a su peor momento desde 2020, ¿puede la inteligencia artificial ser un nuevo motor para ellas? Una empresa mexicana lo comprueba.",https://expansion.mx/emprendedores/2023/06/07/crisis-financiamiento-inteligencia-artificial-startups,07/06/23
Emprendimiento,Expansión,La audacia de una mujer emprendedora impulsa a todas,Por primera vez en México se llevaron a cabo las Bold Conversations by Veuve Clicquot y las charlas giraron en torno al emprendimiento femenino y los retos en nuestro país.,https://expansion.mx/emprendedores/2023/05/31/la-audacia-de-una-mujer-emprendedora-impulsa-a-todas,31/05/23
Emprendimiento,Expansión,500 Global lanza su generación 18 de startups latinoamericanas,"Los fundadores y sus equipos recibieron 16 semanas de trabajo intensivo en producto, fundraising, growth, management además de una oferta de inversión de 80,000 dólares.",https://expansion.mx/emprendedores/2023/05/30/500-global-lanza-generacion-18-startups-latinoamericanas,30/05/23
Emprendimiento,Expansión,Los emprendedores tienen que ser más objetivos y sus valuaciones más aterrizadas,"Denis Yris, fundador y director general, del fondo de venture capital Wortev ve un panorama complicado para los emprendedores en 2023, pero donde aún se pueden aprovechar oportunidades.",https://expansion.mx/emprendedores/2023/05/05/emprendedores-mas-objetivos-y-valuaciones-mas-aterrizadas,05/05/23
Emprendimiento,Expansión,La startup mexicana Pacto levanta 4 mdd en una ronda liderada por DILA Capital,"La startup de pago en puntos de venta utilizará los recursos para expandir su equipo de ingeniería, desarrollo de producto y servicio al cliente.",https://expansion.mx/emprendedores/2023/03/29/startup-pacto-levanta-4-mdd-ronda-liderada-dila-capital,30/03/23
Emprendimiento,Expansión,La chilena Rankmi cierra ronda Serie A y se fusiona con la mexicana Osmos,"La fusión de las compañías y la ronda de inversión, que fue liderada por el fondo SoftBank, sumaron un monto de 48 millones de dólares.",https://expansion.mx/emprendedores/2023/03/01/la-chilena-rankmi-cierra-ronda-serie-a-y-se-fusiona-con-la-mexicana-osmos,01/03/23
Emprendimiento,Expansión,El capital para las startups en América Latina disminuyó 47% en 2022,El estudio presentado por Endeavor México y Glisco Partners mostró que pese a la reducción del Venture Capital se hicieron mayores rondas de inversión para los emprendimientos.,https://expansion.mx/emprendedores/2023/02/23/inversion-startups-latinoamerica-caida-2022,23/02/23
Emprendimiento,Expansión,"AT&T México fomenta la equidad, diversidad e inclusión en el sector empresarial","El objetivo de la compañía es conectar con los sueños de los emprendedores y MiPyMES, impulsando su desarrollo a través de innovación tecnológica y una cultura que permita cambiar el juego en México.",https://expansion.mx/emprendedores/2023/02/13/att-mexico-equidad-diversidad-e-inclusion-sector-empresarial,13/02/23
Emprendimiento,Expansión,5 emprendedores mexicanos que están cambiando al país con ideas innovadoras,"La ASEM dio a conocer a los ganadores de la segunda edición del E-100, en la cual el 55% de los finalistas fueron mujeres.",https://expansion.mx/emprendedores/2023/01/31/5-emprendedores-mexicanos-que-estan-cambiando-al-pais-con-ideas-innovadoras,31/01/23
Emprendimiento,Expansión,La startup que busca cerrar brechas entre la educación y el mercado laboral,La startup canadiense analiza las habilidades de los estudiantes y las compara con las destrezas que requieren las empresas para así trazarles un plan de carrera que los ayude a conseguir empleo.,https://expansion.mx/emprendedores/2023/01/20/la-startup-que-busca-cerrar-brechas-entre-la-educacion-y-el-mercado-laboral,20/01/23
Emprendimiento,Expansión,Se agota el capital de riesgo para los unicornios latinoamericanos,"Las startups más prometedoras de la región están despidiendo a parte de su personal, replanteando sus planes de crecimiento y recurriendo a préstamos bancarios para obtener financiamiento.",https://expansion.mx/emprendedores/2022/12/19/agota-capital-unicornios-latinoamericanos,19/12/22
Emprendimiento,Expansión,Las firmas de banca digital son las favoritas de la inversión fintech,"Desde 2014, dos de cada tres dólares invertidos en fintechs B2C fueron para Bancos Digitales, la categoría con más unicornios, como Nubank, C6 Bank, Inter, Neon y Ualá.",https://expansion.mx/emprendedores/2022/11/29/banca-digital-favoritas-inversion-fintech,29/11/22
Emprendimiento,Expansión,"Kushki no se detendrá hasta conectar todo Latam, asegura su fundador","El 2022 ha sido un año de ensueño para la paytech Kushki, que planea continuar con el ritmo en los siguientes años, confía su fundador Sebastián Castro.",https://expansion.mx/emprendedores/2022/11/25/kushki-conectar-latam-sebastian-castro,25/11/22
Emprendimiento,Expansión,Chicco y Victoria 147 lanzan convocatoria para mamás emprendedoras,A través de la convocatoria se seleccionarán 20 proyectos de madres de familia que quieran validar su idea de emprendimiento.,https://expansion.mx/emprendedores/2022/11/08/chicco-y-victoria-147-convocatoria-emprendedoras,08/11/22
Emprendimiento,Expansión,Kushki lanza unidad para conectar a empresas de pagos globales en América Latina,"El unicornio ecuatoriano lanzó su unidad de negocio Kushki Mundial, el cual busca que las firmas de pagos globales participen de forma local en Latinoamérica.",https://expansion.mx/emprendedores/2022/10/26/kushki-conectar-empresas-pagos-globales-america-latina,26/10/22
Emprendimiento,Expansión,BeGo lanzará programa para otorgar crédito a transportistas,La startup lanzó una herramienta en su app para que los transportistas accedan a una línea de crédito y generen un historial crediticio que les permita brindar su servicio.,https://expansion.mx/emprendedores/2022/10/06/bego-lanzara-programa-para-otorgar-credito-a-transportistas,06/10/22
Emprendimiento,Expansión,México es tierra fértil para el emprendimiento,"La pandemia fue un acelerador de startups valuadas en más de 1,000 millones de dólares. En dos años surgieron diez startups en México que han detonado crecimiento económico, social y cultural.",https://expansion.mx/emprendedores/2022/09/13/mexico-tierra-fertil-emprendimiento,14/09/22
Emprendimiento,Expansión,EXMA apunta a convertirse en la plataforma disruptiva para los negocios,"Se realizará el 21 y 22 de septiembre en la Arena Ciudad de México y marcará la primera visita de Tony Robbins al país, empresario y autor de libros de desarrollo y finanzas personales.",https://expansion.mx/emprendedores/2022/09/13/exma-apunta-a-convertirse-en-la-plataforma-disruptiva-para-los-negocios,14/09/22
Emprendimiento,Expansión,La startup Cuéntame quiere ser el unicornio de la salud mental en Latinoamérica,"La firma que impulsa la salud mental de los colaboradores cerró una ronda de inversión pre semilla por 1.1 millones de dólares, con lo que buscará consolidar su presencia en México, Colombia y Chile.",https://expansion.mx/emprendedores/2022/09/05/la-startup-cuentame-quiere-ser-el-unicornio-de-la-salud-mental-en-latinoamerica,05/09/22
Emprendimiento,Expansión,Hitch cierra ronda de 1.5 mdd para desarrollo de tecnología y nuevos productos,La startup de soluciones de recursos humanos basado en tecnología (HR-Tech) recaudó 1.5 millones de dólares en una ronda de inversión pre-semilla.,https://expansion.mx/emprendedores/2022/07/19/hitch-cierra-ronda-presemilla,19/07/22
Emprendimiento,Expansión,Gunderson Dettmer abre su primera oficina en América Latina,"La firma de abogados especializada en el ecosistema emprendedor se une a la ola de emprendimientos en América Latina y abre su primera oficina en Sao Paulo, Brasil.",https://expansion.mx/emprendedores/2022/07/19/gunderson-dettmer-abre-oficina-america-latina,19/07/22
Emprendimiento,Expansión,Venture Café llega a México para crear un distrito global de innovación,"Venture Café abrió su primera sede en México, y América Latina, en Monterrey, donde buscará ampliar el acceso de emprendedores a capital humano, social, económico, intelectual e incluso político.",https://expansion.mx/emprendedores/2022/06/30/venture-cafe-innovacion-emprendedores,30/06/22
Emprendimiento,Expansión,"Travel tech, un sector que brinda oportunidades para las start-ups en México",La industria de viajes está en una posición única de implementar tecnología e impulsar su ecosistema Travel tech. Distintos hábitos de consumo y mayor capitalización han creado nuevas oportunidades.,https://expansion.mx/emprendedores/2022/06/21/travel-tech-oportunidades-startups-mexico,21/06/22
Emprendimiento,Expansión,BeGo busca integrar un mercado hiperfragmentado: El transportista,La startup busca mejorar la eficiencia del sector transportista al conectar a los dueños de las cargas con quienes la mueven.,https://expansion.mx/emprendedores/2022/06/15/be-go-mercado-transportista,15/06/22
Emprendimiento,Expansión,La edtech Talently levanta una ronda de capital semilla por 3 mdd,El marketplace de empleabilidad de talento tecnológico buscará consolidarse en países latinos. Su promesa es reducir hasta 50% los costos de reclutamiento.,https://expansion.mx/emprendedores/2022/06/02/la-edtech-talently-levanta-una-ronda-de-capital-semilla-por-3-mdd,02/06/22
