Category,Source,Title,Content Summary,URL,Date of Publication
Economía,Expansión,Las exportaciones chinas crecen con fuerza en enero y febrero de 2024,El comercio exterior ha sido un factor clave en el crecimiento económico de China en las últimas décadas y ha generado una gran cantidad de empleos en el sector manufacturero.,https://expansion.mx/economia/2024/03/07/exportaciones-chinas-crecen-en-enero-y-febrero-2024,07/03/24
Economía,Expansión,El compromiso de Citigroup con México es inquebrantable: Jane Fraser,"La CEO de Citigroup destacó que, a pesar de hacer la división del banco en Banamex y Citi México, confían en el liderazgo en la reconfiguración de las cadenas de suministro.",https://expansion.mx/economia/2024/03/07/jane-fraser-citigroup-destaca-compromiso-mexico,07/03/24
Economía,Expansión,"Las mujeres invierten mejor que los hombres, pero reciben menos pensión","La brecha salarial y las tareas de cuidados perjudican el retiro de las mujeres, advierte el grupo financiero suizo UBS.",https://expansion.mx/economia/2024/03/07/eres-mujer-podrias-recibir-menos-pension-que-hombres,07/03/24
Economía,Expansión,El déficit comercial de Estados Unidos se profundiza en enero,"Este saldo en rojo del comercio de bienes y servicios con el resto del mundo alcanzó los 67,400 millones de dólares en el primer mes del año, un aumento de 5.1% con respecto a diciembre pasado.",https://expansion.mx/economia/2024/03/07/deficit-comercial-de-estados-unidos-se-profundiza-en-enero,07/03/24
Economía,Expansión,La inflación se desacelera más de lo esperado durante febrero,La inflación subyacente también mostró un incremento más lento al observado en los últimos meses. El gas LP y la gasolina sufrieron los mayores aumentos de precio el mes pasado.,https://expansion.mx/economia/2024/03/07/inflacion-febrero-2024-desacelera-inegi,07/03/24
Economía,Expansión,"Con todo y nearshoring, las nuevas inversiones se desinflan en México","De acuerdo con cifras oficiales, el año pasado ingresaron 4,817 mdd de nuevas inversiones, cifra que apenas representó 13% del total de la IED; en 2022 este flujo fue equivalente a 50%.",https://expansion.mx/economia/2024/03/07/con-todo-y-nearshoring-las-nuevas-inversiones-se-desinflan-en-mexico,07/03/24
Ciencia y tecnología,La Jornada,“Los eclipses son herramientas que da la naturaleza para conocerla mejor”,"Los eclipses, más allá de atraer la atención de niños y adultos, de dar lugar a mitos e inspirar a literatos, “son herramientas que nos proporciona la naturaleza para conocerla mejor”, afirmó Luis Felipe Rodríguez Jorge. Mediante su observación se ha ampliado el conocimiento sobre el movimiento de los cuerpos en el sistema solar, se descubrió el helio y se comprobó la teoría de la relatividad, así como que la Tierra rota cada vez más lentamente.",https://www.jornada.com.mx/2024/03/07/ciencias/a06n1cie?partner=rss,07/03/24
Ciencia y tecnología,Expansión,La Ley de Mercados Digitales entra en vigor en la UE,La normativa tiene por objeto garantizar que las grandes tecnológicas se comporten de manera equitativa en línea.,https://expansion.mx/tecnologia/2024/03/07/ley-de-mercados-digitales-entra-vigor-union-europea,07/03/24
Ciencia y tecnología,Expansión,"Computadoras de dos pantallas, la nueva tendencia que todos querrán tener","Aunque es una tendencia que pocas empresas están impulsando, cada vez hay más opciones en el mercado para que los usuarios las conozcan.",https://expansion.mx/tecnologia/2024/03/07/laptops-doble-pantalla-seran-nueva-tendencia-computadoras,07/03/24
Cultura,La Jornada,Diputados rinden tributo al creador  de Macondo,"En el aniversario 97 del nacimiento del escritor Gabriel García Márquez, la Cámara de Diputados recordó al premio Nobel de Literatura 1982 como “uno de los maestros de la literatura universal” y ponderó “su genialidad y su contribución al patrimonio cultural de la humanidad”.",https://www.jornada.com.mx/2024/03/07/cultura/a04n2cul?partner=rss,07/03/24
Cultura,La Jornada,Llega a Rusia “una buena historia”,"Moscú. La novela póstuma de Gabriel García Márquez, En agosto nos vemos, salió ayer a la luz en Rusia, confirmó el grupo editorial AST.",https://www.jornada.com.mx/2024/03/07/cultura/a03n3cul?partner=rss,07/03/24
Cultura,La Jornada,"Artistas cubanos colaboran a fomentar el muralismo en San Salvador, Hidalgo","San Salvador, Hgo., Como parte de las actividades para impulsar el interés de los vecinos de las comunidades indígenas en la elaboración de murales y en las artes plásticas, fue develado el pasado 1º de marzo el mural Hermanamiento de nuestras raíces y corazones de América, en la localidad otomí de El Rodrigo, del municipio de San Salvador, Hidalgo.",https://www.jornada.com.mx/2024/03/07/cultura/a05n2cul?partner=rss,07/03/24
Cultura,La Jornada,Explora Tomás Pérez Vejo la “invención” de México,"El historiador Tomás Pérez Vejo, en su libro La nación doliente: Imágenes profanas para una historia sagrada (Instituto Nacional de Antropología e Historia, 2024), relata cómo a partir del siglo XIX se deja de contar en la pintura de México la historia del nacimiento, muerte y resurrección de Cristo para narrar la historia del nacimiento, muerte y resurrección de la nación mexicana.",https://www.jornada.com.mx/2024/03/07/cultura/a05n1cul?partner=rss,07/03/24
Cultura,La Jornada,José Cueli: El Goya de Palillo,"Cristina de Hoyos, flamenca de la flamenquería catalana, magia de magias, se vistió de futbolista del equipo Barcelona, por una parte, y, por la otra, de Puma universitario. Todo esto en el marco del Camp Nou, en el que no cabía ni una mosca más, vibrando en el instante de aprisionar en unos pases el ritmo de la furia española futbolera tornada rumba flamenca, vibrante y que escondía su amor por el pintor aragonés. ¡Goya, goya!",https://www.jornada.com.mx/2024/03/07/cultura/a04a1cul?partner=rss,07/03/24
Cultura,La Jornada,Víctor Benítez define la máscara como una metáfora de la identidad,"Más que un artefacto para ocultar el rostro o representar a alguien o algo más, el fotógrafo Víctor Benítez entiende a la máscara como un concepto o metáfora de la identidad, tema al que ha encaminado gran parte de su interés y propuesta creativos.",https://www.jornada.com.mx/2024/03/07/cultura/a04n1cul?partner=rss,07/03/24
Cultura,La Jornada,"Organizan oaxaqueños el primer Carnaval Indígena Costeño en Santa Ana, California","Preservar su cultura, “parte de lo que somos y de dónde venimos”, así como poner en alto el nombre de México y de su lugar de origen, San Pedro Jicayán, es la razón por la que migrantes de este municipio de la zona costera de Oaxaca, radicados en Santa Ana, California, decidieron organizar el primer Carnaval Indígena Costeño en esa ciudad de Estados Unidos.",https://www.jornada.com.mx/2024/03/07/cultura/a02n1cul?partner=rss,07/03/24
Cultura,La Jornada,Continúa el idilio de los mexicanos con el Nobel colombiano,"La admiración por el escritor Gabriel García Márquez (1927-2014) continúa en México. Ayer, un joven lector se mostraba embebido en el Metro con la lectura de la emblemática novela El amor en los tiempos del cólera. Al preguntarle si conocía el texto inédito En agosto nos vemos, expresó su deseo de obtenerlo “cuanto antes”.",https://www.jornada.com.mx/2024/03/07/cultura/a03n2cul?partner=rss,07/03/24
Cultura,La Jornada,Los lectores españoles celebran la publicación de En agosto nos vemos,"Madrid. “Al tratarse de una novela de Gabriel García Márquez y, más aún, de un libro inédito y póstumo, había mucha expectativa. Y eso se ha notado en el primer día que salió a la venta. Sólo en las primeras horas hemos vendido más de 100 ejemplares, al margen de toda la gente que ha estado preguntando los últimos días por la novela”, relató un responsable de una de las librerías más importantes de Madrid, La Central, que desde la mañana cambió algunos de sus escaparates para situar en un lugar privilegiado los ejemplares de En agosto nos vemos, que publica en España la editorial Random House, mientras en México y Centroamérica lo hace la editorial Diana, del Grupo Planeta.",https://www.jornada.com.mx/2024/03/07/cultura/a03n1cul?partner=rss,07/03/24
Deportes,La Jornada,Intercambio de mascotas,,https://www.jornada.com.mx/2024/03/09/deportes/a11n3dep?partner=rss,09/03/24
Deportes,La Jornada,"Samantha Terán, el éxito tras la lucha contra las barreras de género","Samantha Terán, la consagración del éxito y la batalla por derribar barreras de género. El récord de medallas regionales que ostenta la mejor jugadora de squash que ha tenido México va respaldado por el esfuerzo como atleta, así como por una contienda alterna para conseguir una igualdad salarial y el reconocimiento que le corresponde a la categoría femenil.",https://www.jornada.com.mx/2024/03/09/deportes/a09n1dep?partner=rss,09/03/24
Deportes,La Jornada,"COI, sin temor a posibles huelgas en los Olímpicos","París. Pierre Olivier Beckers, presidente de la Comisión de Coordinación del Comité Olímpico Internacional (COI), quien está de visita en París, dijo ayer que no teme a las huelgas en Francia de cara a los Juegos.",https://www.jornada.com.mx/2024/03/09/deportes/a11n2dep?partner=rss,09/03/24
Deportes,La Jornada,En Pumas no hay crisis: Ulises Rivas,"Ulises Rivas, mediocampista de Pumas, descartó que su equipo atraviese por una crisis, luego de sumar dos derrotas consecutivas (ante Chivas y Monterrey) y no poder ganar en ninguno de sus encuentros como visitante, donde registra dos empates y tres descalabros.",https://www.jornada.com.mx/2024/03/09/deportes/a10n3dep?partner=rss,09/03/24
Deportes,La Jornada,"Con apuros, el Barcelona vence 1-0 al Mallorca del Vasco Aguirre","Barcelona. Con un juego deslucido y más problemas de los esperados, el Barcelona ganó por la mínima (1-0) en casa al Mallorca, dirigido por el técnico mexica-no Javier Vasco Aguirre, ayer en la apertura de la jornada 28 de la Liga española.",https://www.jornada.com.mx/2024/03/09/deportes/a10n4dep?partner=rss,09/03/24
Deportes,La Jornada,Verstappen se queda con la pole; Checo saldrá tercero,"Está vez Sergio Pérez no alcanzó la pole position como los últimos dos años, pero sí un tercer lugar que dejará buen lugar al mexicano para el Gran Premio de Arabia Saudita.",https://www.jornada.com.mx/2024/03/09/deportes/a11n1dep?partner=rss,09/03/24
Deportes,La Jornada,Elige Canelo a Munguía; pelearán el 4 de mayo,El anuncio tan esperado llegó. El mexicano Saúl Canelo Álvarez se enfrentará el 4 de mayo a Jaime Munguía en la T-Mobile Arena de Las Vegas.,https://www.jornada.com.mx/2024/03/09/deportes/a27n1dep?partner=rss,09/03/24
Deportes,La Jornada,"Un festejo color morado; Águilas, sublíderes","El futbol femenil produce mensajes que se escuchan como un imperativo. Cada partido es un espacio que abre nuevas rendijas en la memoria, una manera de recordar a las primeras mujeres que se entusiasmaron con patear una pelota cuando todo eran obstáculos y viejos estigmas. Jugar un 8 de marzo conlleva ese valor simbólico, porque, más que una fecha, es una historia y una declaración. “Jugamos por la equidad”, mostraban en una pancarta color lila las profesionales del América, minutos antes vencer de 4-1 al Puebla.",https://www.jornada.com.mx/2024/03/09/deportes/a10n1dep?partner=rss,09/03/24
Deportes,La Jornada,"América, un sueño difícil para todo canterano: Naveda","En el América, los jóvenes de fuerzas básicas suelen ser considerados actores de reparto. Como el futbol es considerado una expresión cultural, la presión ante las fases finales de un torneo y los grandes partidos definen el rasgo por excelencia de una institución acostumbrada a ganar títulos, más allá de la formación de jugadores. “Desde pequeño uno aprende que todos los rivales aspiran a ganarle al América”, afirma el mediocampista Santiago Naveda, uno de los pocos integrantes de su generación que han logrado hacerse de un lugar en el equipo.",https://www.jornada.com.mx/2024/03/09/deportes/a10n2dep?partner=rss,09/03/24
Economía,La Jornada,Creación de empleo en EU superó expectativas: 275 mil en febrero,"Washington. La economía estadunidense creó 275 mil empleos en febrero, cifra que superó las expectativas de los analistas. Si bien la tasa de desempleo aumentó ligeramente, podría decirse que el mercado laboral se está reequilibrando.",https://www.jornada.com.mx/2024/03/09/economia/016n1eco?partner=rss,09/03/24
Economía,La Jornada,"Empleo, elemento central de la inclusión financiera","La falta de financiamiento para alcanzar la igualdad de género en el mundo observa un déficit de 360 mil millones de dólares, situación “alarmante”, pues es un obstáculo para lograr la meta de equidad para 2030, de acuerdo con la Organización de Naciones Unidas (ONU).",https://www.jornada.com.mx/2024/03/09/economia/014n1eco?partner=rss,09/03/24
Economía,La Jornada,Mercado laboral de Estados Unidos se reequilibra,,https://www.jornada.com.mx/2024/03/09/economia/016n3eco?partner=rss,09/03/24
Economía,La Jornada,Senado de EU aprobó paquete de gastos por 467 mil 500 mdd y evitó cierre del gobierno,"Washington. El Senado de Estados Unidos evitó por poco un cierre parcial del gobierno este viernes, cuando la Cámara alta aprobó la legislación de gastos para varias agencias gubernamentales apenas unas horas antes de que expirara el financiamiento actual.",https://www.jornada.com.mx/2024/03/09/economia/014n2eco?partner=rss,09/03/24
Economía,La Jornada,Tipo de cambio toca su nivel más bajo en lo que va del año,"El tipo de cambio concluyó la jornada de ayer en 16.7985 pesos, una apreciación semanal de 1.31 por ciento, el menor nivel en lo que va de 2024 y el más bajo desde septiembre de 2023, cuando el dólar se cotizó en 16.7477, según datos del Banco de México (BdeM).",https://www.jornada.com.mx/2024/03/09/economia/014n3eco?partner=rss,09/03/24
Economía,La Jornada,Precio del bitcóin superó la barrera de 70 mil dólares,"Londres. Tras superar la barrera de los 70 mil dólares, el bitcóin rompió récord ayer impulsado por las especulaciones sobre un recorte de los tipos de interés en Estados Unidos.",https://www.jornada.com.mx/2024/03/09/economia/016n2eco?partner=rss,09/03/24
Economía,La Jornada,Silvia Ribeiro*: El negocio de tapar el sol con un dedo,,https://www.jornada.com.mx/2024/03/09/economia/015a1eco?partner=rss,09/03/24
Economía,La Jornada,México requiere más infraestructura por la relocalización: IP,"México requiere mayor infraestructura carretera, pero también de otro tipo de conectividad logística como aeropuertos o ferrocarriles para aprovechar la relocalización de empresas en la reconfiguración de la cadena de suministros, pues actualmente hay cuellos de botella, como ocurre en los puertos, donde están llegando todos los autos importados, pero no hay cómo movilizarlos, indicó Francisco Solares Alemán, presidente de la Cámara Mexicana de la Industria de la Construcción (CMIC).",https://www.jornada.com.mx/2024/03/09/economia/015n1eco?partner=rss,09/03/24
Economía,Expansión,Estados Unidos libra (otra vez) el cierre de su gobierno,Legisladores aprueban de última hora un paquete de financiación para mantener abiertas varias agencias gubernamentales.,https://expansion.mx/economia/2024/03/08/estados-unidos-libra-otra-vez-el-cierre-de-su-gobierno,09/03/24
Economía,Expansión,Las condiciones laborales de las mujeres en 8 gráficas,"Las trabajadoras en México carecen, en su mayoría, de acceso a instituciones de salud y ganan hasta un salario mínimo, con jornadas laborales de entre 35 y 48 horas.",https://expansion.mx/economia/2024/03/08/8m-condiciones-laborales-mujeres-mexico-graficas,08/03/24
Economía,Expansión,"Desde la CDMX, las mujeres impulsan una agenda económica y social","Por primera vez, las líderes en temas económicos y empresariales se están uniendo para una sola causa: generar su propia agenda, señala la Asociación Mexicana de Mujeres Jefas de Empresa (AMMJE).",https://expansion.mx/economia/2024/03/08/ammje-cdmx-mujeres-impulsan-agenda-economica-y-social,08/03/24
Ciencia y tecnología,La Jornada,Es muy importante el tema de género y hacer frente a las resistencias y el desconocimiento,"Al principio la sola idea de impulsar la perspectiva de género en áreas dedicadas a la ciencia y la ingeniería, le parecía un reto mayúsculo. Pero conforme profundizó en los estudios de género y se despertó su interés en esta intersección ciencia y género, Mónica Vásquez Hernández, doctora en Bioelectrónica en el Centro de Investigación y Estudios Avanzados del Instituto Politécnico Nacional, se convenció de la factibilidad de transversalizar el tema de género en lo que sea que esté haciendo.",https://www.jornada.com.mx/2024/03/09/ciencias/a05n1cie?partner=rss,09/03/24
Ciencia y tecnología,Expansión,Competencia para YouTube: Musk llevará videos largos a tu smart tv a través de X,"Una app de X estará disponible para clientes de Amazon y Samsung, la próxima semana, afirmó el multimillonario.",https://expansion.mx/tecnologia/2024/03/09/competencia-youtube-musk-videos-largos-smart-tv-app-x,09/03/24
Ciencia y tecnología,Expansión,Sam Altman vuelve a la junta directiva de OpenAI,"Una investigación independiente reveló que el despido de Altman, en noviembre pasado, no era justificado y era producto de una pérdida de confianza con otros miembros de la junta.",https://expansion.mx/tecnologia/2024/03/08/sam-altman-vuelve-a-la-junta-directiva-de-openai,08/03/24
Ciencia y tecnología,Expansión,EU busca prohibir TikTok; Biden firmaría la ley si el Congreso la aprueba,La Cámara de Representantes de EU busca que ByteDance venda la empresa en ese país o bien enfrentar una prohibición de la plataforma.,https://expansion.mx/tecnologia/2024/03/08/legisladores-lanzan-plan-para-vetar-tiktok-en-eu,08/03/24
Ciencia y tecnología,Expansión,EU arresta a un exingeniero de Google por robar secretos de IA para China,El implicado supuestamente sustrajo información confidencial durante un año para beneficiar a su emprendimiento y a otra empresa del país asiático.,https://expansion.mx/tecnologia/2024/03/08/arrestan-exingeniero-google-robar-secretos-para-china,08/03/24
Cultura,La Jornada,La UNAM rinde homenaje a la cineasta Nancy Cárdenas; se restauró y restrenó México de mis amores,"El documental México de mis amores (1979), dirigido por Nancy Cárdenas (1934-1994), preservado por la Filmoteca de la Universidad Nacional Autónoma de México (UNAM), fue objeto de un trabajo de corrección de color y digitalización.",https://www.jornada.com.mx/2024/03/09/cultura/a04n2cul?partner=rss,09/03/24
Cultura,La Jornada,Estamos muy lejos de ocupar el lugar que merecemos como luchadoras: Lady Apache,"Las mujeres no han alcanzado aún el reconocimiento que merecen en la lucha libre mexicana, según Lady Apache, una de sus exponentes y leyendas vivas más importantes.",https://www.jornada.com.mx/2024/03/09/cultura/a04n1cul?partner=rss,09/03/24
Cultura,La Jornada,"La mujer ha ido tomando su sitio en la pintura, pero los vacíos persisten","La mano de las mujeres siempre ha estado presente en la pintura, la escultura y la gráfica, aunque a veces de forma invisible ante el público. Apenas hace medio siglo han dado su lugar en la historia de la producción pictórica a Artemisa Gentileschi (1593-1654), italiana de gran talento cuyos cuadros solían ser atribuidos a su padre o a otros artistas varones. Era considerada una rareza y, por tanto, una autora menor.",https://www.jornada.com.mx/2024/03/09/cultura/a02n1cul?partner=rss,09/03/24
Cultura,La Jornada,"Bailarinas valoran la innovación, fuerza y disrupción de sus mentoras","Martha Graham, Doris Humphrey, Guillermina Bravo, Gladiola Orozco, Laura Rocha, Cecilia Appleton, Anadel Lynton, así como la alemana Pina Bausch, por su disciplina y perseverancia, han sido ejemplo para otras mujeres en la danza.",https://www.jornada.com.mx/2024/03/09/cultura/a03n1cul?partner=rss,09/03/24
Deportes,La Jornada,"Choques violentos entre hooligans, fenómeno que crece desde 2021","Berlín. En menos de cinco días desde el inicio de la Eurocopa, las peleas organizadas entre aficionados que acuden a los estadios siguen en aumento. El temor a lesiones que pongan en riesgo la vida de las familias, que se aprestan a presenciar la segunda ronda de la fase de grupos, agrava las preocupaciones de seguridad en Alemania. Ayer, seguidores de Turquía y Georgia protagonizaron una pelea en la casa del Borussia Dortmund, el Wesfalenstadion, antes del partido del Grupo F.",https://www.jornada.com.mx/2024/06/19/deportes/a11n2dep?partner=rss,19/06/24
Deportes,La Jornada,"Derrotan Yanquis 4-2 a Orioles, pero Aaron Judge sale lesionado","Nueva York. Aaron Judge, uno de los mejores torpederos de las Grandes Ligas, recibió un pelotazo en el meñique de la mano izquierda y abandonó el juego de ayer, en el que los Yanquis de Nueva York ganaron 4-2 a los Orioles de Baltimore. El primer duelo de la serie entre los dos clubes con más victorias en la Liga Americana provocó otra preocupación para los neoyorquinos, apenas un encuentro después de que el primera base Anthony Rizzo se fracturó el antebrazo derecho.",https://www.jornada.com.mx/2024/06/19/deportes/a37n1dep?partner=rss,19/06/24
Deportes,La Jornada,CR7 desafía al tiempo y celebra con Portugal,"Portugal, la última de las favoritas en estrenarse en la Eurocopa 2024, desafió las leyes del tiempo y presentó su candidatura a ser protagonista en una competencia que ya conquistó hace ocho años. Con los veteranos Pepe y Cristiano Ronaldo, derrotó 2-1 a República Checa para ser sublíder del Grupo B.",https://www.jornada.com.mx/2024/06/19/deportes/a11n1dep?partner=rss,19/06/24
Deportes,La Jornada,"A los 40 años, Alejandra Zavala se reinventa; irá a sus terceros JO","En 2023, Alejandra Zavala resurgió de las cenizas tras enfrentar violencia de pareja por parte de quien entonces era su entrenador. Fortalecida y con nuevas metas en el tintero, la especialista en tiro deportivo logró reinventarse y bri-llar en los Juegos Centroamericanos de San Salvador y Panameri-canos en Santiago para convertirse nuevamente en olímpica a los 40 años de edad.",https://www.jornada.com.mx/2024/06/19/deportes/a12n1dep?partner=rss,19/06/24
Deportes,La Jornada,Djokovic asistirá por quinta vez a la cita veraniega,"Novak Djokovic competirá este año en los Juegos Olímpicos de París, anunció el Comité Olímpico de Serbia.",https://www.jornada.com.mx/2024/06/19/deportes/a12n2dep?partner=rss,19/06/24
Deportes,La Jornada,"Murió Willie Mays, el pelotero que  hizo del beisbol un acto de alegría","Willie Mays, el electrizante pelotero cuya combinación singular de talento, actitud y expresividad lo convirtió en uno de los deportistas más queridos y destacados en la historia de Estados Unidos, murió. Emblema de los Gigantes de Nueva York y después de San Francisco, pero también un ícono de la igualdad, pues inició en 1948 su carrera en las Ligas Negras, aquel circuito donde se marginó a los jugadores afroestadunidenses, dentro de las filas de los Black Barons. Tenía 93 años.",https://www.jornada.com.mx/2024/06/19/deportes/a10n1dep?partner=rss,19/06/24
Economía,La Jornada,Se pierden 7.5 mdd al día por el freno al aguacate michoacano,"Mientras las negociaciones continúan para levantar el bloqueo a las exportaciones de aguacate de México a Estados Unidos luego de que se reportara que dos inspectores estadunidenses fueron agredidos en Michoacán, este martes el embajador Ken Salazar informó que el Servicio de Inspección de Sanidad Animal y Vegetal (APHIS) del Departamento de Agricultura de EU suspendió las inspecciones de aguacate y mango en ese estado del país.",https://www.jornada.com.mx/2024/06/19/economia/025n1eco?partner=rss,19/06/24
Economía,La Jornada,"Enrique Dussel Peters*: Autos eléctricos, comercio e inversiones, ¿cómo entender a China en 2024?","Muy contento de iniciar con colaboraciones periódicas en La Jornada sobre una diversidad de temas socioeconómicos y con cierto énfasis en China. Buscaremos examinar estos temas invitando a la reflexión conceptual, metodológica e incluyendo aspectos de coyuntura y de política económica. ¡Bienvenidos a múltiples debates, siempre con referencia a América Latina y el Caribe (ALC) y a México!",https://www.jornada.com.mx/2024/06/19/economia/023a1eco?partner=rss,19/06/24
Economía,La Jornada,Creció inversión en bonos después de las elecciones,"En la primera semana de junio –tras las elecciones presidenciales–, inversionistas extranjeros aumentaron sus posiciones en bonos respaldados por el gobierno mexicano, es decir, compraron mayor deuda gubernamental, revelan datos oficiales.",https://www.jornada.com.mx/2024/06/19/economia/022n1eco?partner=rss,19/06/24
Economía,La Jornada,Descalifica AMLO las estimaciones de crecimiento del FMI,"El presidente Andrés Manuel López Obrador descalificó ayer las estimaciones de crecimiento económico de México hechas por el Fondo Monetario Internacional (FMI) para el periodo 2025-2027 y aseguró que el país mantendrá políticas económicas autónomas de las dictadas por esa organización y el Banco Mundial, pues “el humanismo mexicano con economía moral funciona mejor”.",https://www.jornada.com.mx/2024/06/19/economia/026n1eco?partner=rss,19/06/24
